author,body,created_utc,permalink,subreddit
Soylent_but_deadly,"My favorite hole-in-the-wall is Minca Ramen in East Village. They have, I believe, a peanut based broth for their Miso that's very good. It's far more quaint than an Ippudo or Momofuku. ",1508266135.0,/r/AskNYC/comments/76ziu5/best_place_to_get_ramen_in_ny/doi2s1n/,AskNYC
lasagnaman,"ramenya in westvillage is my favorite, hide-chan is a close second.",1508268061.0,/r/AskNYC/comments/76ziu5/best_place_to_get_ramen_in_ny/doi4qvs/,AskNYC
drjimmybrungus,"My favorite is Tamashii Ramen in Astoria (they also have a location in LIC and Forest Hills), their kara miso ramen bowl is fantastic.

You may enjoy perusing this list on Eater NY: https://ny.eater.com/maps/nyc-ramen-best",1508266361.0,/r/AskNYC/comments/76ziu5/best_place_to_get_ramen_in_ny/doi3077/,AskNYC
Plato222,Jin Ramen in the UWS is great. Best chicken based ramen in the city is Totto Ramen on 52nd and 9th,1508261594.0,/r/AskNYC/comments/76ziu5/best_place_to_get_ramen_in_ny/dohybyj/,AskNYC
jalapenocreamcheese,Ramen Misoya on 2nd Ave is the closest thing I've had to real Japanese ramen in the city.,1508270816.0,/r/AskNYC/comments/76ziu5/best_place_to_get_ramen_in_ny/doi7kl6/,AskNYC
lumpy_potato,"Naruto Ramen. Very small, cash only (IIRC), but great portions, great broth, great noodles, and great bowls. Go during lunch for some nice specials. ",1508275061.0,/r/AskNYC/comments/76ziu5/best_place_to_get_ramen_in_ny/doibv0a/,AskNYC
didntbreakthepipe,"Ippudo is incredibly overrated in my opinion.

I would recommend: ichiran, Chuko, Minca, MomoFuku probably in that order. All four of these places are extremely different but fantastic. ",1508267080.0,/r/AskNYC/comments/76ziu5/best_place_to_get_ramen_in_ny/doi3q8x/,AskNYC
deeday12,Totto Ramen on 51st and 10th and Naruto Ramen are good ,1508275573.0,/r/AskNYC/comments/76ziu5/best_place_to_get_ramen_in_ny/doiccdw/,AskNYC
patopeking,Totto Ramen,1508278269.0,/r/AskNYC/comments/76ziu5/best_place_to_get_ramen_in_ny/doiesem/,AskNYC
benalene,"Zundo Ya is right around the corner from Ippudo, and is much better in my opinion. Plus, there is rarely a wait. I also like Terakawa (Columbus Circle) and Kambi House (same people as Minca, I believe, but easier to get to!). ",1508280839.0,/r/AskNYC/comments/76ziu5/best_place_to_get_ramen_in_ny/doih0ur/,AskNYC
Notthatiblameyou,"How is Mu Ramen not on here? Fucks sake. Mu Ramen in LIC. Get the tonkotsu. They open at 5, show up at 4:45 to get in line ",1508279492.0,/r/AskNYC/comments/76ziu5/best_place_to_get_ramen_in_ny/doifvdn/,AskNYC
Cantioy87,I used to enjoy Terakawa when it was by Gramercy. There's still one by Columbus Circle. Naruto Ramen is tasty too (89th and 3rd).,1508272209.0,/r/AskNYC/comments/76ziu5/best_place_to_get_ramen_in_ny/doi90gh/,AskNYC
DC25NYC,"Chuko, Ippudo, Hide-Chan, Momofuku Noodle and Ganso are my faves (in that order)

I've heard great things about Ichiran and Mu Ramen too, but have yet to go. ",1508256469.0,/r/AskNYC/comments/76ziu5/best_place_to_get_ramen_in_ny/dohtby5/,AskNYC
TheVooge,Hino Maru in Astoria is awesome.,1508265810.0,/r/AskNYC/comments/76ziu5/best_place_to_get_ramen_in_ny/doi2gha/,AskNYC
TheGayAficionado,"Generally the two best for tonkotsu are Ippudo and Ichiran (IMO). They're both pretty expensive (~$16 - $20) but can't be beat in terms of taste. 

Ippudo has much more of a hip, loud-music vibe. Ichiran, on the other hand is amazing for the experience with their taste concentration booths (the walls of the booths can be broken down if you're going with someone else). ",1508265942.0,/r/AskNYC/comments/76ziu5/best_place_to_get_ramen_in_ny/doi2l2t/,AskNYC
yawer93,Jeju in west village has great ramyun (Korean version) too,1508267738.0,/r/AskNYC/comments/76ziu5/best_place_to_get_ramen_in_ny/doi4erz/,AskNYC
,[Rokc](http://rokcnyc.com/) uptown was out of control good when I went last winter.,1508272266.0,/r/AskNYC/comments/76ziu5/best_place_to_get_ramen_in_ny/doi92ks/,AskNYC
evrtgurnot,Samurai Papa in East Williamsburg has held a solid spot in my heart for awhile. ,1508269368.0,/r/AskNYC/comments/76ziu5/best_place_to_get_ramen_in_ny/doi639j/,AskNYC
metaphorm,[Jun-Men in Chelsea](http://www.junmenramen.com/) is very good and has especially good appetizers. Try the sweet potato fries! They serve them with an incredible maple butter dipping sauce. ,1508264047.0,/r/AskNYC/comments/76ziu5/best_place_to_get_ramen_in_ny/doi0q2i/,AskNYC
Empath1999,my fav is ippudo by union square.,1508271943.0,/r/AskNYC/comments/76ziu5/best_place_to_get_ramen_in_ny/doi8qc5/,AskNYC
MaxIsAlwaysRight,"Okinii on Thompson street is one of my favorites, but shoutouts to Wagamama, Ippudo, and Tamashii. ",1508272341.0,/r/AskNYC/comments/76ziu5/best_place_to_get_ramen_in_ny/doi95cu/,AskNYC
Mumbojmbo,"I think everyone has covered the good spots, but I'll just give my vote to Chuko and Momofuku Noodle. Momofuku used to be my top choice, but I've gotten hooked on Chuko (and it's a much more laid back experience, IMO - not that the Momofuku experience is bad at all, if anything it feels more *special* but sometimes special is a little exhausting haha). ",1508279700.0,/r/AskNYC/comments/76ziu5/best_place_to_get_ramen_in_ny/doig1ts/,AskNYC
gocougs11,"Naruto Ramen. 89th & 3rd. Pretty small, so it gets crowded quick, but its amazing.",1508284021.0,/r/AskNYC/comments/76ziu5/best_place_to_get_ramen_in_ny/doijprd/,AskNYC
milkeytoast,Mu in lic,1508286032.0,/r/AskNYC/comments/76ziu5/best_place_to_get_ramen_in_ny/doilhul/,AskNYC
MonkeyPlug,"Okidoki in Astoria. Solid ramen, the best onigiri  and pretty great spicy pork buns.  ",1508287464.0,/r/AskNYC/comments/76ziu5/best_place_to_get_ramen_in_ny/doimvl9/,AskNYC
briangerardo,Has ICHIRAN seriously not been mentioned yet!? That place is so authentic and delicious the water is delicious!,1508288732.0,/r/AskNYC/comments/76ziu5/best_place_to_get_ramen_in_ny/doio1om/,AskNYC
soymilk17,"Ippudo has already been mentioned but I think it’s quite good as long as there’s not a crazy wait. 

Ramen Lab is also pretty good too.",1508297460.0,/r/AskNYC/comments/76ziu5/best_place_to_get_ramen_in_ny/doivks2/,AskNYC
Jigglypuffing,I moved out of NYC a few years back -- is Benkei still around? That was the top place when I was there. ,1508286086.0,/r/AskNYC/comments/76ziu5/best_place_to_get_ramen_in_ny/doiljtu/,AskNYC
,"You can go to Soba Totto (in Midtown), they have the real Japanese taste. Also, you can try Momosan (in Midtown) from Masaharu Morimoto, it's a good ramen spot.",1508289893.0,/r/AskNYC/comments/76ziu5/best_place_to_get_ramen_in_ny/doip35e/,AskNYC
ggrindelwald,"Current Favorites:

* E.A.K. Ramen - Iekei style ramen - Recommend The EAK or Zebra
* Ramen Lab - Ramen pop up shop run by Sun Noodle

Standouts:

* Totto Ramen - Chicken Paitan - Recommend the Spicy Miso
* Ichiran - Tonkotsu - Fully customizable 
* Mokbar - Very rich and flavorful (Korean Ramyun)

Good not great (in no particular order):

* Ippudo
* Momofuku
* Momosan
* Ramen-ya
* Takashi - Only after midnight on Fridays and Saturdays
* Jun-men
* Mew Men
* Jeju Noodle Bar - New and popular (Korean Ramyun)

Not a fan:

* Ivan Ramen
* Wagamama",1508296569.0,/r/AskNYC/comments/76ziu5/best_place_to_get_ramen_in_ny/doiuvt3/,AskNYC
Eowyn27,"So this is an odd story but I went to Ippudo few years ago and I was very disappointed. It was a long wait and I felt the Ramen wasn't that special. I really liked their sake drinks though and apps. I recently went to Ippudo again with a group and it was the BEST Ramen I ever had! Maybe it depends on what you order but I had the Ramen with the burnt garlic and there was so much explosive flavor in there, it was amazing. 

Funnily enough, I tried Ivan's Ramen a few weeks and later, I would have to say, avoid at all costs. Ivan's terribly overrated. 

Go for Ippudo and Totto Ramen is good too! 

If you're in Queens, definitely check out Tamashii Ramen in Astoria as well. ",1508298185.0,/r/AskNYC/comments/76ziu5/best_place_to_get_ramen_in_ny/doiw4md/,AskNYC
SirLudicrus,Nishida shoten is my low-key all round favorite.,1508299044.0,/r/AskNYC/comments/76ziu5/best_place_to_get_ramen_in_ny/doiwrde/,AskNYC
thansal,"Damn, no one's said Nakamura Ramen yet.

They're right next to the Williamsburg Bridge on Delancy.  Tiny little place, more expensive than some other places(over $20 pp w/ drinks and appetizers), but really worth it.  The Tontoro (pork based) is damn good, the truffle miso (vegan) was damn good, the Mazeman was damn good, the Curry Spice was good, I haven't tried the chicken based one yes.

Their appetizers are ok, but don't stand out like the ramen.",1508343817.0,/r/AskNYC/comments/76ziu5/best_place_to_get_ramen_in_ny/dojmey9/,AskNYC
ozmotion,"Instructions for Ippudo:

Go before you're hungry. Leave your name and phone. Go bar hopping for 90 minutes in the East Village. Return for your reservation and enjoy ramen. ",1509739397.0,/r/AskNYC/comments/76ziu5/best_place_to_get_ramen_in_ny/dpazqoe/,AskNYC
eurtoast,"Ramen setagaya on 34 1/2 St Mark's. Tasty, cheap, and quick.",1508264854.0,/r/AskNYC/comments/76ziu5/best_place_to_get_ramen_in_ny/doi1iti/,AskNYC
affiki16,Thanks!,1508271897.0,/r/AskNYC/comments/76ziu5/best_place_to_get_ramen_in_ny/doi8oo7/,AskNYC
ThrivingLight,Any suggestions for ramen places that  uses vegitarian broth?,1508282578.0,/r/AskNYC/comments/76ziu5/best_place_to_get_ramen_in_ny/doiihcr/,AskNYC
braveliltoasterr,I love [Zen 6's](https://www.yelp.com/biz/zen-6-new-york) miso ramen.,1508291346.0,/r/AskNYC/comments/76ziu5/best_place_to_get_ramen_in_ny/doiqeu1/,AskNYC
mathy0u,"Zundo-Ya - Right around the corner from Ippudo, I think it's better and you won't have to wait anywhere near as long. You can also choose how fatty the tonkotsu broth is. This is my personal favorite. 

Mu Ramen - In LIC, there will probably be a wait but totally worth it. 

Momofuku Noodle - Always a solid choice, not the best in the city though. 

Naruto - If you're close to the UES, a really good neighborhood spot.
",1508351299.0,/r/AskNYC/comments/76ziu5/best_place_to_get_ramen_in_ny/dojtw38/,AskNYC
Kxmee,Ippudo!! But Jin Ramen is a good alternative.,1508262680.0,/r/AskNYC/comments/76ziu5/best_place_to_get_ramen_in_ny/dohze82/,AskNYC
astray71,Ippudo is my favorite in East Village.,1508287882.0,/r/AskNYC/comments/76ziu5/best_place_to_get_ramen_in_ny/doin9t8/,AskNYC
w3gv,Momosan or Ippudo,1508289716.0,/r/AskNYC/comments/76ziu5/best_place_to_get_ramen_in_ny/doioxio/,AskNYC
ilDres,"Good ramen but it is so small, gets packed very easily. ",1508274431.0,/r/AskNYC/comments/76ziu5/best_place_to_get_ramen_in_ny/doib9m1/,AskNYC
NYKyle610,"Ippudo is super popular now, but I still think it's the best ramen in the city.

After that, my favorites are Totto & Ivan.",1508338335.0,/r/AskNYC/comments/76ziu5/best_place_to_get_ramen_in_ny/dojh6dt/,AskNYC
nyalriv580,"Yes! I work in the West Village and just randomly stumbled upon Ramenya one day. Loved it but kind of forgot about it for a few months then went back the other day. Not crowded, small place, fast service, awesome ramen! Favorite lunch spot right now.",1508284221.0,/r/AskNYC/comments/76ziu5/best_place_to_get_ramen_in_ny/doijvs0/,AskNYC
Host_Mask,Came here to recommend this place as well. I particularly enjoy the Tantanmen bowl.,1508272164.0,/r/AskNYC/comments/76ziu5/best_place_to_get_ramen_in_ny/doi8yrv/,AskNYC
jgan96,"Ramen Misoya is fantastic but small. If I can't get a table there I go to Rai Rai Ken just a few blocks away, fantastic cha-su.",1508287074.0,/r/AskNYC/comments/76ziu5/best_place_to_get_ramen_in_ny/doimiht/,AskNYC
stoplooklisten_again,"Naruto is my preferred spot as well. I'll add that the location in the UES, while smaller, seems to taste way better than the BK location. ",1508332754.0,/r/AskNYC/comments/76ziu5/best_place_to_get_ramen_in_ny/dojcj4k/,AskNYC
nyalriv580,"> Naruto Ramen

As someone who has just binge watched 300 episodes of Naruto, this existing makes me extremely happy.",1508284333.0,/r/AskNYC/comments/76ziu5/best_place_to_get_ramen_in_ny/doijz6l/,AskNYC
,"I've got to second the opinion that Ippudo is overrated.  A few years ago I went and there was a two hour wait to get ramen.  Later I decided to go before they opened for dinner and there was still a ten minute wait.  I think that's pretty ridiculous.  Needless to say, I had the ramen there and was not impressed.  It's good, but it's not 2-hour wait great.",1508268139.0,/r/AskNYC/comments/76ziu5/best_place_to_get_ramen_in_ny/doi4trk/,AskNYC
haaiou,"Ichiran is even more overrated in my opinion. It doesnt taste good, wait could be long, and location sucks. ",1508301456.0,/r/AskNYC/comments/76ziu5/best_place_to_get_ramen_in_ny/doiyd8r/,AskNYC
apreche,"I agree that Ippudo is overrated and not worth the wait. However, it's still pretty damn good, and totally worth it if you don't have to wait. The appetizer buns are also quite tasty. I like to go there and beat the rush. Get seated immediately if I go straight from work.",1508296119.0,/r/AskNYC/comments/76ziu5/best_place_to_get_ramen_in_ny/doiui81/,AskNYC
haaiou,"I was really interested in giving Minca another try as I didn't like it the last time I went, which was about 4-5 years ago. But now that I know Terakawa is run by the same people, I lost all interest.",1508333346.0,/r/AskNYC/comments/76ziu5/best_place_to_get_ramen_in_ny/dojcz6d/,AskNYC
Nav_Panel,The new Terakawa location by Columbus Circle isn't the same IMO. The Tan Tan wasn't as good as back when it was by Gramercy.,1508274505.0,/r/AskNYC/comments/76ziu5/best_place_to_get_ramen_in_ny/doibc32/,AskNYC
metaphorm,"good list. Chuko and Ganso are my favorites of the ones you've listed. I found Mu Ramen to be fine, but not a standout. Wouldn't go out of my way for it. ",1508263976.0,/r/AskNYC/comments/76ziu5/best_place_to_get_ramen_in_ny/doi0nkc/,AskNYC
extrovertangel,Second on Hide-chan,1508278093.0,/r/AskNYC/comments/76ziu5/best_place_to_get_ramen_in_ny/doiemph/,AskNYC
thansal,"Mu is really good.  It's one of the few that I thought was worth the extra price point.  Though as others have said, the Oxtail is ridiculously good, and it's what I had, maybe the others aren't as great.",1508342910.0,/r/AskNYC/comments/76ziu5/best_place_to_get_ramen_in_ny/dojlike/,AskNYC
haaiou,"both are super overrated, long wait & overpriced, not worth it. Compare to itself in Japan, their ramen taste bland (small dishes are good tho). There are much better ramen place in NYC",1508333520.0,/r/AskNYC/comments/76ziu5/best_place_to_get_ramen_in_ny/dojd3x7/,AskNYC
ShatteringFast,"I go all over and eat all the vegan ramen I can find, but this place is still my favorite.",1508291336.0,/r/AskNYC/comments/76ziu5/best_place_to_get_ramen_in_ny/doiqehi/,AskNYC
kurrmurrpurr,SAMURAI PAPA!! can't say enough about their vegan ramen (with egg noodles though). I enjoy the broth so much more than any other meat-based ramen.,1508293968.0,/r/AskNYC/comments/76ziu5/best_place_to_get_ramen_in_ny/doisol1/,AskNYC
haaiou,I love their noodles but one time it gave me a massive food poisoning two hours after I ate there. I stopped going. ,1508301610.0,/r/AskNYC/comments/76ziu5/best_place_to_get_ramen_in_ny/doiygpb/,AskNYC
haaiou,"I give this place 3 out of 10. So so food, long wait, and terrible location. ",1508301682.0,/r/AskNYC/comments/76ziu5/best_place_to_get_ramen_in_ny/doiyia1/,AskNYC
haaiou,I second ramen lab. Been there twice and was pleasantly surprised both times,1508301721.0,/r/AskNYC/comments/76ziu5/best_place_to_get_ramen_in_ny/doiyj7u/,AskNYC
petrotympanicfissure,I second momosan,1508330766.0,/r/AskNYC/comments/76ziu5/best_place_to_get_ramen_in_ny/dojb5m0/,AskNYC
haaiou,"Great list. But I don’t get why ichiran being fully customizable is a good thing. The chef should know how a bowl of noodle tastes the best, and we are messing up the portion/cooking procedure. ",1508301859.0,/r/AskNYC/comments/76ziu5/best_place_to_get_ramen_in_ny/doiymet/,AskNYC
Citadelthrowaway2,"Ivan ramen is just chicken noodle soup, with somewhat interesting noodles.",1508375591.0,/r/AskNYC/comments/76ziu5/best_place_to_get_ramen_in_ny/dokg7pu/,AskNYC
DC25NYC,"I've been to their w-burg location. 

It's really good. ",1508266179.0,/r/AskNYC/comments/76ziu5/best_place_to_get_ramen_in_ny/doi2tn7/,AskNYC
EeMmBb,Chuko's has amazing miso vegetarian broth. Even my friends who eat meat prefer it.,1508283888.0,/r/AskNYC/comments/76ziu5/best_place_to_get_ramen_in_ny/doijlre/,AskNYC
ShatteringFast,Samurai Papa has god-tier vegan ramen.,1508291365.0,/r/AskNYC/comments/76ziu5/best_place_to_get_ramen_in_ny/doiqff9/,AskNYC
Lemonyhampeapasta,Hinomaru ,1508333793.0,/r/AskNYC/comments/76ziu5/best_place_to_get_ramen_in_ny/dojdbdo/,AskNYC
thansal,"Nakamura, it's pretty great.",1508449056.0,/r/AskNYC/comments/76ziu5/best_place_to_get_ramen_in_ny/dolw35p/,AskNYC
Sea_Unicorn,"There's also a sister store, kambi ramen on 1st and 14th",1508278296.0,/r/AskNYC/comments/76ziu5/best_place_to_get_ramen_in_ny/doietaq/,AskNYC
koleye,Seconded.,1508347148.0,/r/AskNYC/comments/76ziu5/best_place_to_get_ramen_in_ny/dojpp89/,AskNYC
thansal,"Basically it's decent Tonkotsu, but it's not worth the wait, or the couple extra $ compared to Hide Chan (the other serious Tonkotsu ramen that I know of), who I honestly just think are better.

Also: Pork buns just aren't anywhere on the same scale as Momofuku, and cost about the same.",1508342714.0,/r/AskNYC/comments/76ziu5/best_place_to_get_ramen_in_ny/dojlbpx/,AskNYC
didntbreakthepipe,"To each their own. I really enjoyed the ramen, even though there is only 1 kind. I’ve heard of long waits but the times I’ve went it was only about 20 mins in the waiting room. The main con of ichiran is the price I think it’s not the best value wise. But man you really gotta give bushwick a chance - it’s actually really awesome!!
",1508329267.0,/r/AskNYC/comments/76ziu5/best_place_to_get_ramen_in_ny/doja8ll/,AskNYC
didntbreakthepipe,I went about 3 years ago and I wasn’t impressed. But tbh I don’t even remember what I got. I think I’ll need to give it another shot maybe during lunch or like you mentioned right after work ,1508329341.0,/r/AskNYC/comments/76ziu5/best_place_to_get_ramen_in_ny/dojaa5e/,AskNYC
drjimmybrungus,"He was saying Kambi Ramen House is from the same people as Minca, not Terakawa. Terakawa is affiliated with Naruto Ramen though.",1508351110.0,/r/AskNYC/comments/76ziu5/best_place_to_get_ramen_in_ny/dojtp57/,AskNYC
benalene,"As drjimmybrungus said, I meant that Kambi is run by the same people as Minca, not Terakawa. Sorry that wasn't clear! ",1508363403.0,/r/AskNYC/comments/76ziu5/best_place_to_get_ramen_in_ny/dok5y9l/,AskNYC
Cantioy87,Damn. That was my favorite. I worked across the street from there for a few years and enjoyed getting Tan Tan on Fridays as my special lunch day.,1508278252.0,/r/AskNYC/comments/76ziu5/best_place_to_get_ramen_in_ny/doiervy/,AskNYC
tentativetitle,"Chuko is my favorite spot in NYC, but I'm going to try the others mentioned on here.",1508266651.0,/r/AskNYC/comments/76ziu5/best_place_to_get_ramen_in_ny/doi3aif/,AskNYC
ahwitz,"IMO - Mu Ramen is only worth going to to try their house bone marrow/oxtail/corned beef/pickle/cabbage one once. The shoyu/tonkotsu are fine but definitely not worth the price; the broth on the house ramen is unbelievable, though.",1508286361.0,/r/AskNYC/comments/76ziu5/best_place_to_get_ramen_in_ny/doiltt2/,AskNYC
evrtgurnot,Yep I always get the vegan ramen with egg noogles. It's seriously the most delightful thing where everything is justttt right. And the people I bring always speak highly of the meat ramen. You should check out the vegan ramen at Za-Ya ramen in Gowanus and Kogane in Brooklyn Heights as well—really good broth and noodles. ,1508334211.0,/r/AskNYC/comments/76ziu5/best_place_to_get_ramen_in_ny/dojdn7u/,AskNYC
patopeking,Ugh...as a former Tokyo resident that sounds so bizarre ha.,1508342759.0,/r/AskNYC/comments/76ziu5/best_place_to_get_ramen_in_ny/dojldct/,AskNYC
briangerardo,You're out of your mind. Noodles 11/10,1508302605.0,/r/AskNYC/comments/76ziu5/best_place_to_get_ramen_in_ny/doiz2ll/,AskNYC
ggrindelwald,"I see your point, but I also think that different people are allowed to enjoy ramen differently. I, for example, tend to favor richer broths and eat more quickly than some of my friends. Being able to choose noodles that are a little more firm might be more appealing to them as it allows the noodles to continue cooking while they eat.",1508415438.0,/r/AskNYC/comments/76ziu5/best_place_to_get_ramen_in_ny/dol1fzx/,AskNYC
evrtgurnot,"""god-tier,"" yes.",1508334398.0,/r/AskNYC/comments/76ziu5/best_place_to_get_ramen_in_ny/dojdsnj/,AskNYC
benalene,"I did not know that Terakawa was affiliated with Naruto Ramen. That is interesting, because I did not care for Naruto at all, but love Terakawa.",1508363317.0,/r/AskNYC/comments/76ziu5/best_place_to_get_ramen_in_ny/dok5vej/,AskNYC
haaiou,"Thanks for the clarification. When you say affiliated, do you mean they have the same menu? Or same chef?",1508371533.0,/r/AskNYC/comments/76ziu5/best_place_to_get_ramen_in_ny/dokcu9k/,AskNYC
kurrmurrpurr,I'll check out Kogane...always looking for a reason to get out to bk heights,1508335043.0,/r/AskNYC/comments/76ziu5/best_place_to_get_ramen_in_ny/dojebjh/,AskNYC
kurrmurrpurr,There's a decently sized market of people who don't want to senselessly kill animals and harm the environment just for broth. Imagine that!,1508347358.0,/r/AskNYC/comments/76ziu5/best_place_to_get_ramen_in_ny/dojpxlt/,AskNYC
haaiou,"I had better. First, I don’t get why being fully customizable is a good thing. The chef should know how a bowl of noodle tastes the best, and we are messing up the portion/cooking procedure. Second, it tastes much worse compare to the one in Japan. ",1508304080.0,/r/AskNYC/comments/76ziu5/best_place_to_get_ramen_in_ny/doizwk7/,AskNYC
drjimmybrungus,"They're owned by the same people but I've never been to Terakawa so not sure if the recipes they use are the same at both places.

http://terakawaramenny.com/about/our-brands/",1508371802.0,/r/AskNYC/comments/76ziu5/best_place_to_get_ramen_in_ny/dokd2ha/,AskNYC
Ngo_Knows,"I've been to all the major ones.  


My favorite is Totto Ramen.  ",1538749947.0,/r/AskNYC/comments/9lmkh6/great_ramen_suggestions_please_d/e77sthr/,AskNYC
RayZR,"My list in personal order of preference:

 * Nakamura
 * Misoya
 * Karakatta
 * Totto Ramen
 * Ramen Setagaya
 * Hide-Chan
 * Minca (great tsukemen)
 * Zundo-Ya (used to love the tonkatsu here - quality dipped down so I haven't been in a couple years but *maybe* it's picked back up again...)
 * Ramen Lab (*special mention* - not actually the last in preference, but hard to put into the rank since they swap ramen chefs in and out on a monthly basis)",1538752614.0,/r/AskNYC/comments/9lmkh6/great_ramen_suggestions_please_d/e77w0xi/,AskNYC
momomoomi,Chuko in Brooklyn is great. ,1538752441.0,/r/AskNYC/comments/9lmkh6/great_ramen_suggestions_please_d/e77vtdm/,AskNYC
thetonyhightower,Tamashii in Astoria is aces.,1538751591.0,/r/AskNYC/comments/9lmkh6/great_ramen_suggestions_please_d/e77usxj/,AskNYC
theo313,Me and my wife really enjoy Mr. Taka.,1538756216.0,/r/AskNYC/comments/9lmkh6/great_ramen_suggestions_please_d/e780f30/,AskNYC
Arleare13,"Here are some good lists:

https://www.thrillist.com/eat/new-york/best-ramen-in-nyc#

https://www.timeout.com/newyork/restaurants/best-ramen-in-nyc

http://www.grubstreet.com/bestofnewyork/best-ramen-nyc.html

http://gothamist.com/2016/02/18/best_ramen_nyc.php",1538748971.0,/r/AskNYC/comments/9lmkh6/great_ramen_suggestions_please_d/e77rok9/,AskNYC
114631,"**Ippudo** - wait times can get insane, the atmosphere and everything about it is a little pretentious, but the ramen is incredible. A huge plus though is that there are plenty of bars around if you want to grab a drink while waiting.


**Mu Ramen**


**Izakaya** on the Upper West Side. Very simple, but the closest thing I've found to Ippudo's extremely rich broth.",1538749538.0,/r/AskNYC/comments/9lmkh6/great_ramen_suggestions_please_d/e77sc1h/,AskNYC
,"Ramen Shack, Ramen Lab, Tonchin, Yokoya, Menko, Menkoi Sato, Shuya Cafe de Ramen",1538748951.0,/r/AskNYC/comments/9lmkh6/great_ramen_suggestions_please_d/e77rnqc/,AskNYC
esagalyn,"Ippudo hands down. I used to live near both Ippudo and Totto and Totto pales in comparison. Also, Ippudo lets you wait at another bar and calls you when your table is ready; Totto makes you wait outside. Both places can have insane wait times, so this makes a huge difference when it’s bitterly cold outside (which is the best weather for ramen!).",1538777281.0,/r/AskNYC/comments/9lmkh6/great_ramen_suggestions_please_d/e78pnji/,AskNYC
panic_bread,Ramen Ya ,1538759216.0,/r/AskNYC/comments/9lmkh6/great_ramen_suggestions_please_d/e7842ez/,AskNYC
ogie666,Bassanova in Chinatown is pretty solid. ,1538764739.0,/r/AskNYC/comments/9lmkh6/great_ramen_suggestions_please_d/e78atsf/,AskNYC
knoxelf,ROKC if you’re up in the Hamilton Heights area,1538774733.0,/r/AskNYC/comments/9lmkh6/great_ramen_suggestions_please_d/e78mx67/,AskNYC
goldenfeder,Totto Ramen is the best! Seriously my favorite,1538750829.0,/r/AskNYC/comments/9lmkh6/great_ramen_suggestions_please_d/e77tvhr/,AskNYC
xbakery,"Nakamura, Ramen Lab, Ramen Shack, Ivan Ramen",1538755375.0,/r/AskNYC/comments/9lmkh6/great_ramen_suggestions_please_d/e77zebj/,AskNYC
elkresurgence,Momosan Ramen on Midtown East was a revelation. ,1538757712.0,/r/AskNYC/comments/9lmkh6/great_ramen_suggestions_please_d/e7828ze/,AskNYC
unicorn_pants,mu ramen in long island city. their tonkotsu is closest to what i’ve had in japan. ,1538758634.0,/r/AskNYC/comments/9lmkh6/great_ramen_suggestions_please_d/e783d2w/,AskNYC
jango_broughty,Mu in LIC is great,1538765311.0,/r/AskNYC/comments/9lmkh6/great_ramen_suggestions_please_d/e78bibb/,AskNYC
