author,body,created_utc,permalink,subreddit
raindrop777,I prefer Jing Fong to The Golden Unicorn (FWIW).,1515880305.0,/r/AskNYC/comments/7q60ss/dim_sum_in_nyc_ramen_too/dsmxhc5/,AskNYC
soymilk17,"I prefer Golden Unicorn, but both are pretty good.",1515929430.0,/r/AskNYC/comments/7q60ss/dim_sum_in_nyc_ramen_too/dsntlnc/,AskNYC
Flickerdart,"Keep in mind that the carts are not there all day long. For Jing Fong, the best hours for carts are 10 - 2:30 on the weekend. For Golden Unicorn, I think it's similar.",1515951504.0,/r/AskNYC/comments/7q60ss/dim_sum_in_nyc_ramen_too/dso7bh1/,AskNYC
IlezAji,"I've actually never been to the Kuro Obi location, from what I can see though it doesn't have their regular tonkatsu  broth (rich, fatty, pork) which is what I think Ippudo does particularly well buuut the Kuro Obi location actually isn't too far from their 5th ave outpost, something like a 5-10 minute walk IIRC. 

Of course if you wind up snowed in at some point during your trip you could then hit up the Kuro Obi location and compare. :P",1515868946.0,/r/AskNYC/comments/7q60ss/dim_sum_in_nyc_ramen_too/dsmnika/,AskNYC
,"It is expensive, but good.",1515967620.0,/r/AskNYC/comments/7q60ss/dim_sum_in_nyc_ramen_too/dson9ru/,AskNYC
lost_in_life_34,"It’s full of Asians and I was there with Asian friends

It was ok because the food is just not for me",1515868292.0,/r/AskNYC/comments/7q60ss/dim_sum_in_nyc_ramen_too/dsmmxhw/,AskNYC
kawarazu,"Totto Ramen is my leader at the moment, and Ramen-Ya is my second-favorite.  Shoutout goes to Jin Ramen for having some fantastic eggs (though Ramen-Ya is definitely comparable.)

Naruto is my favorite near-by spot though, since they do take-out.",1426185812.0,/r/AskNYC/comments/2ysbgd/in_your_opinion_what_is_the_best_ramen_in_nyc/cpct3oz/,AskNYC
yakhauler,"Ippudo. 

It reminds me of the first ramen joint I visited in Osaka. It's packed, it's welcoming, and you can eat at the bar. The izakaya stuff like the pork buns are also spot freaking on. 

Is it worth the wait? Sometimes, especially if you want that feel. Also otafuku is close by for round 2.

Now I'll admit that hide chan's broth are more consistently delicious... 

Damn I'm hungry. ",1426170744.0,/r/AskNYC/comments/2ysbgd/in_your_opinion_what_is_the_best_ramen_in_nyc/cpcjvee/,AskNYC
wingsta,"Currently Mu Ramen in long Island City.  The owner/chef used to work for Per Se.  His place had a great review from Pete Wells.  Good luck getting a  seat though.  Mu Ramen's hours are very limited.  Monday to Saturday from 5:30 PM to 10 PM only. The usually wait unless you get there when it just opens are over an hour because of the combination of limited hours, popularity, and tiny size of the place.
",1426167802.0,/r/AskNYC/comments/2ysbgd/in_your_opinion_what_is_the_best_ramen_in_nyc/cpcif6u/,AskNYC
unndunn,Hide-Chan FTW.,1426184459.0,/r/AskNYC/comments/2ysbgd/in_your_opinion_what_is_the_best_ramen_in_nyc/cpcs7qp/,AskNYC
kokoromelody,"Mu Ramen is excellent; I'm a huge fan of the Spicy Miso, and they have a number of excellent starters (the U&I, okonomiyaki, etc.) as well as a regularly changing ramen option.

Takashi's Midnight Ramen is well worth the trip, too. One of the few all beef-based ramen, that has the tenderest beef belly and an addicting spicy paste. You can add foie gras to it too, for a $14 supplement.

Otherwise, Ramen Misoya, Totto, and Zen 6 are some other good places to get too, and no crazy waits/reservations needed.",1426198865.0,/r/AskNYC/comments/2ysbgd/in_your_opinion_what_is_the_best_ramen_in_nyc/cpd1dj0/,AskNYC
lolbbq,chukko,1426176118.0,/r/AskNYC/comments/2ysbgd/in_your_opinion_what_is_the_best_ramen_in_nyc/cpcmy4a/,AskNYC
SwellandDecay,Hide Chan and/or Totto they're owned by the same guy and both serve some of the most delicious food I've ever had in my life,1426171138.0,/r/AskNYC/comments/2ysbgd/in_your_opinion_what_is_the_best_ramen_in_nyc/cpck2ya/,AskNYC
Kaneshadow,"I gotta vote for Ippudo.  I've had Hide-chan and Totto, they're both great but the Ippudo experience is 100% for the following reasons.

They put on the whole show.  everyone shouts at you in japanese when you first walk in.  The staff all seem happy and into it.  They have a great variety of broths and noodles.  They make their own noodles which is rareish.  They have some amazing special ramens from time to time.  They have a bar.  My recommendation is, go at around 6pm, it's easily worth the hour wait if you stand by the bar and get a bottle of sake and a plate of shishitos.

If you want the best non-traditional ramen, you need to get a seat for the ramen tasting menu at Yuji in Brooklyn.",1426172124.0,/r/AskNYC/comments/2ysbgd/in_your_opinion_what_is_the_best_ramen_in_nyc/cpcklxk/,AskNYC
Edman006,Hide chan! ,1426216635.0,/r/AskNYC/comments/2ysbgd/in_your_opinion_what_is_the_best_ramen_in_nyc/cpdb9tb/,AskNYC
,I've moved to Manhattan from queens. I too think the pho sucks in Manhattan but in queens it's great. Try pho bac or pho bang in Jackson heights or mekong in flushing. It's delicious ,1426218383.0,/r/AskNYC/comments/2ysbgd/in_your_opinion_what_is_the_best_ramen_in_nyc/cpdc52v/,AskNYC
irmikexp,Hide-Chan or Totto. Sorry to the Ippudo lovers out there but I feel like its too over-rated.,1426165862.0,/r/AskNYC/comments/2ysbgd/in_your_opinion_what_is_the_best_ramen_in_nyc/cpchl49/,AskNYC
DC25NYC,"Hide-Chan or honestly, its very untraditional but Dale Talde's Breakfast Ramen is my favorite. 
",1426166543.0,/r/AskNYC/comments/2ysbgd/in_your_opinion_what_is_the_best_ramen_in_nyc/cpchv2e/,AskNYC
Unoriginal_UserName9,Men-Kui-Tei on 56th between between 5th and 6th. ,1426170953.0,/r/AskNYC/comments/2ysbgd/in_your_opinion_what_is_the_best_ramen_in_nyc/cpcjzfi/,AskNYC
,Totto....and I have to agree with the Pho comment. Having moved here from Dallas I am sadly disappointed in the lack of quality Pho here.,1426172719.0,/r/AskNYC/comments/2ysbgd/in_your_opinion_what_is_the_best_ramen_in_nyc/cpckxon/,AskNYC
idiot206,Jin Ramen on 125th and Broadway is my favorite so far. The spicy tonkotsu is great. Good happy hour prices on sake also.,1426184192.0,/r/AskNYC/comments/2ysbgd/in_your_opinion_what_is_the_best_ramen_in_nyc/cpcs1a3/,AskNYC
themassiah,"I know all the hipsters will hate me for saying it, but Momofuku has some top-notch ramen.  There's also a little place in Brooklyn called Kinjo that has really good ramen.",1426171217.0,/r/AskNYC/comments/2ysbgd/in_your_opinion_what_is_the_best_ramen_in_nyc/cpck4gq/,AskNYC
captars,"I really like Totto, but also Ivan Ramen Slurp Shop.",1426173441.0,/r/AskNYC/comments/2ysbgd/in_your_opinion_what_is_the_best_ramen_in_nyc/cpclchv/,AskNYC
jwalke22,Hide-Chan is freaking amazing....Ippudo is completely overrated,1426175129.0,/r/AskNYC/comments/2ysbgd/in_your_opinion_what_is_the_best_ramen_in_nyc/cpcmcj7/,AskNYC
drogean3,"ive gone to both Totto and Ippudo and had their pork ramen. I don't even like ramen that much.

Both come at a whopping $14 for fucking noodle soup.


Totto is tiny, hot, and a claustrophobics nightmare. Also Grade Pending for sanitation grade.

Hide-Chan has great appetizers for happy hour but flavorless broth when it comes to ramen. What a let down. Sanitation grade pending too.

Ippudo has a great modern look to it and all the waiters shout japanese so it even feels more authentic. Graded A for sanitation.

Ippudo was definintely better
",1426182373.0,/r/AskNYC/comments/2ysbgd/in_your_opinion_what_is_the_best_ramen_in_nyc/cpcqud6/,AskNYC
coasts,"there isn't a best ramen.  what there is, though, is an array of options.  like pizza, paella, and burgers, there's not one style of ramen, so it's impossible to say what is the best.  for some, Hide Chan will be too rich.  Ippudo may be too straightforward.  Momofuku might be too non-traditional.  Jin's noodles may be too chewy or not chewy enough.  

the ramen offering in New York is vast enough and the top players are fairly well documented.  i feel like it's something you've just got to decide for yourself.  ",1426212843.0,/r/AskNYC/comments/2ysbgd/in_your_opinion_what_is_the_best_ramen_in_nyc/cpd99fx/,AskNYC
Empath1999,"my opinion is ippudo's, particularly the tonkotsu broth :D",1426162297.0,/r/AskNYC/comments/2ysbgd/in_your_opinion_what_is_the_best_ramen_in_nyc/cpcgd4l/,AskNYC
makesureimjewish,This comment has been overwritten by an open source script to protect this user&apos;s privacy.,1428354576.0,/r/AskNYC/comments/2ysbgd/in_your_opinion_what_is_the_best_ramen_in_nyc/cq3dh2w/,AskNYC
soybean,http://www.newyorkramen.com/ is my favorate.,1426171990.0,/r/AskNYC/comments/2ysbgd/in_your_opinion_what_is_the_best_ramen_in_nyc/cpckj8h/,AskNYC
JelliedHam,If you're stuck in Midtown and hungry for lunch Ise on 56th between 5th and 6th is pretty damn good. Is it the best? No. But damn good. I order it nearly once every week. ,1426177179.0,/r/AskNYC/comments/2ysbgd/in_your_opinion_what_is_the_best_ramen_in_nyc/cpcnl0x/,AskNYC
bustygold,"I've been to very few of these places, but I'm excited to try more. But why down vote places like Ippudo? I've been there. Not the greatest place but I wouldn't say it's a bad suggestion. ",1426180703.0,/r/AskNYC/comments/2ysbgd/in_your_opinion_what_is_the_best_ramen_in_nyc/cpcpsmw/,AskNYC
dogeax,"I am a huge fan of Jin ramen. It's a little out of the way, but because I live up here anyway, Jin is great. I actually prefer it to Ippudo, purely because the wait for two never approaches the hour/2 hour wait time Ippudo has. And it is right off the 1 so it is relatively easy to get to.
",1426194892.0,/r/AskNYC/comments/2ysbgd/in_your_opinion_what_is_the_best_ramen_in_nyc/cpcyyur/,AskNYC
lieuline,I really like Minca in e village,1426211071.0,/r/AskNYC/comments/2ysbgd/in_your_opinion_what_is_the_best_ramen_in_nyc/cpd8aew/,AskNYC
NoranaC,My favorite place is Tabata on 9th and 40th.,1426195607.0,/r/AskNYC/comments/2ysbgd/in_your_opinion_what_is_the_best_ramen_in_nyc/cpczegf/,AskNYC
thesweetestpunch,"I never remember the name, but the best ramen I've had so far in queens is in a little noodle shop just across from the target/red lobster mall in rego park. Just nails it.",1426166410.0,/r/AskNYC/comments/2ysbgd/in_your_opinion_what_is_the_best_ramen_in_nyc/cpcht58/,AskNYC
bottegaveneta,"Santouka in Edgewater, NJ is also really good.

Also, have you tried Pho Vietnam in Manhattan Chinatown? Surprisingly good pho there, i think.",1426266731.0,/r/AskNYC/comments/2ysbgd/in_your_opinion_what_is_the_best_ramen_in_nyc/cpdts9v/,AskNYC
jesselectric,Ivan is good. Totto is better. But for my money Momofuku's Momofuku ramen is the best. Plus they have by far the best pork buns. ,1426194647.0,/r/AskNYC/comments/2ysbgd/in_your_opinion_what_is_the_best_ramen_in_nyc/cpcyt9i/,AskNYC
uselessartsdegree,Terakawa on 9th Ave FTW!,1426220195.0,/r/AskNYC/comments/2ysbgd/in_your_opinion_what_is_the_best_ramen_in_nyc/cpdczew/,AskNYC
drogean2,"Agreed. Went to hidechan today after all the comments and the spicy garlic broth is spicy but flavorless.

Have also tried totto ramen  and wasn't impressed.

Since they all cost exactly the same I'd say ippudo is best",1426288239.0,/r/AskNYC/comments/2ysbgd/in_your_opinion_what_is_the_best_ramen_in_nyc/cpe67ft/,AskNYC
irmikexp,"I've had Mu and I will agree it's not bad, but to me flavor-wise Hide-Chan wins my vote. Also, Mu does same day reservations starting at 3PM by calling but only parties of 4 or less.",1426172560.0,/r/AskNYC/comments/2ysbgd/in_your_opinion_what_is_the_best_ramen_in_nyc/cpckumg/,AskNYC
helpful_grey,"I think I failed my Hide experience :( 

I ordered the super greasy version because I was a greedy little porker, and it tasted too fatty, and it made me ill. I can't go back there with my loser porker face. ",1426214241.0,/r/AskNYC/comments/2ysbgd/in_your_opinion_what_is_the_best_ramen_in_nyc/cpda0v2/,AskNYC
DC25NYC,Been meaning to go there for a bit now. ,1426182107.0,/r/AskNYC/comments/2ysbgd/in_your_opinion_what_is_the_best_ramen_in_nyc/cpcqo9i/,AskNYC
,Hide-Chan is a gem.,1426248068.0,/r/AskNYC/comments/2ysbgd/in_your_opinion_what_is_the_best_ramen_in_nyc/cpdkcdt/,AskNYC
themassiah,"Ippudo is very good, a close second to Momofuku.  They are much more accommodating, service-wise.  They also have some REALLY good izakaya-type food there.",1426175158.0,/r/AskNYC/comments/2ysbgd/in_your_opinion_what_is_the_best_ramen_in_nyc/cpcmd5g/,AskNYC
Kaneshadow,I am just not quite a fan of the momofuku ramen... not against it but he makes some flavor decisions that I don't love.  Just not my preference.  Other than that the quality of the food there is pretty great overall.,1426171796.0,/r/AskNYC/comments/2ysbgd/in_your_opinion_what_is_the_best_ramen_in_nyc/cpckfk5/,AskNYC
wingsta,"I think it's a matter of opinion and tastes then.  I had Hide-Chan first over 5 years ago when they just started and I think they used to be so much better.  They use to offer how rich you want the broth to be and 3 levels of ramen thickness but that was all taken away.  Now, I prefer their more popular sister restaurant, Totto Ramen.  Not saying Hide-Chan is bad. Far from it. It just used to be better.",1426490508.0,/r/AskNYC/comments/2ysbgd/in_your_opinion_what_is_the_best_ramen_in_nyc/cpgdmx6/,AskNYC
lolbbq,Usually a wait but bar chukko across the street is equally stellar and has a bit more variety ,1426182183.0,/r/AskNYC/comments/2ysbgd/in_your_opinion_what_is_the_best_ramen_in_nyc/cpcqpxx/,AskNYC
themassiah,"Not trying to argue, I'm genuinely curious:  what do you dislike or find  lacking in the momofuku ramen?  I've always thought that it was rich, deep, and well-executed.",1426175105.0,/r/AskNYC/comments/2ysbgd/in_your_opinion_what_is_the_best_ramen_in_nyc/cpcmbzt/,AskNYC
irmikexp,Agreed that its just a matter of opinion. I never knew about the levels of thickness but I know they still give you the option of the broths and also the firmness of the noodles.,1426517625.0,/r/AskNYC/comments/2ysbgd/in_your_opinion_what_is_the_best_ramen_in_nyc/cpgl6f4/,AskNYC
DC25NYC,Yeah I've heard that. Similar to the way Pok Pok does it. Obv not ramen but same idea. They get so busy they just send people to the Whisky Soda Lounge and now Phat Thai as well. I only really go for the wings there. They're great. ,1426182288.0,/r/AskNYC/comments/2ysbgd/in_your_opinion_what_is_the_best_ramen_in_nyc/cpcqsew/,AskNYC
Kaneshadow,"I forget what he adds to give it a smokey flavor, but I wasn't a fan.

The rest of the food there is great but to be honest I do think it's a bit overhyped, not his fault, but they're also on the way to my laundromat, so I get annoyed when there are people blocking the sidewalk.  I acknowledge none of these things are Yelpable offenses but they contribute to me never really going there.
",1426187562.0,/r/AskNYC/comments/2ysbgd/in_your_opinion_what_is_the_best_ramen_in_nyc/cpcu8rg/,AskNYC
seruhndipitee,"Ippudo and Totto are probably the two most popular in NYC. They both have multiple locations now. Totto specializes in paitan (chicken) broth, which is good if you or someone you're eating with doesn't eat pork. Out of those two, I prefer Ippudo.  

Other ramen restaurants I like include Minca, Hide-chan (owned by the same people who own Totto, but this place specializes in pork broth), Momofuku (really started this ramen craze, but I wouldn't say it's the best), Ivan (fairly new, has some less traditional styles), Chuko (BK). Almost any neighborhood has some good ramen places nearby. I'm waiting for pho to catch up...",1420342533.0,/r/FoodNYC/comments/2r97ps/ramen_in_nyc/cndrar0/,FoodNYC
imitationcheese,Jin Ramen.,1420341964.0,/r/FoodNYC/comments/2r97ps/ramen_in_nyc/cndqze4/,FoodNYC
sarahkate89,hinomaru in astoria,1420334458.0,/r/FoodNYC/comments/2r97ps/ramen_in_nyc/cndn0ik/,FoodNYC
thejellyjam,"takashi - late night for beef ramen

ippudo - for pork ramen and pork buns

toto - for chicken ramen

and for vegetarian, go to udon west or soba-ya both around st marks not midtown. they're not ramen but have alot of good vegetable noodle options",1420342217.0,/r/FoodNYC/comments/2r97ps/ramen_in_nyc/cndr4b4/,FoodNYC
peter_pounce,My favorites are Minca in Alphabet City and Setagaya on St Marks,1420361741.0,/r/FoodNYC/comments/2r97ps/ramen_in_nyc/cndz915/,FoodNYC
sarahkate89,ivan ramen on the LES,1420427637.0,/r/FoodNYC/comments/2r97ps/ramen_in_nyc/cneqtx2/,FoodNYC
Siette,"My personal favorite is Zen 6 on 6th between 1st and 2nd. They're pretty small (maybe 20 seats, max), so I don't recommend them for a large group of people and they're cash only, but they're the best I've tried.",1420334965.0,/r/FoodNYC/comments/2r97ps/ramen_in_nyc/cndna2g/,FoodNYC
PooveyFarmsRacer,"Ippudo, Zutto, and Naruto are all excellent",1420379685.0,/r/FoodNYC/comments/2r97ps/ramen_in_nyc/cne305i/,FoodNYC
SirYoureMakingAScene,"Ippudo (westside is my preferred location) for the akamura modern ramen. Add the additional pulled pork to this and it is lifechanging. The pork buns here are my favorite food in the city. 

I also really enjoy Bassanova Ramen in Chinatown. ",1420382825.0,/r/FoodNYC/comments/2r97ps/ramen_in_nyc/cne3u9o/,FoodNYC
SubSolSubUmbraVirens,Mu Ramen in LIC is the new hype.  ,1420394745.0,/r/FoodNYC/comments/2r97ps/ramen_in_nyc/cne8wwl/,FoodNYC
finalfrogo,Dassara in Carroll Gardens is fantastic,1420336783.0,/r/FoodNYC/comments/2r97ps/ramen_in_nyc/cndo8uj/,FoodNYC
RobotPigOverlord,Totto ramen is SO good,1420345915.0,/r/FoodNYC/comments/2r97ps/ramen_in_nyc/cndt46c/,FoodNYC
jgl2832,"It might be because it was the first place I had ramen in the city, but I really like miso-ya on St marks and 2nd. I can always get a table there. I also really like Minca ramen in the east village, because i have a gluten free SO and they have a good gluten free ramen.
Then there is also Jin ramen, which is amazing, and now has locations on 125/broadway and 82/amsterdamn",1421002414.0,/r/FoodNYC/comments/2r97ps/ramen_in_nyc/cnlnppq/,FoodNYC
,Ramen Yebisu in Williamsburg is as authentic as it gets here,1420346495.0,/r/FoodNYC/comments/2r97ps/ramen_in_nyc/cndter5/,FoodNYC
EmilGH,"All good suggestions... Give Yasha Ramen a shot:

http://yasharamen.com

The tonkotsu is really, really good...",1420997089.0,/r/FoodNYC/comments/2r97ps/ramen_in_nyc/cnlkqt4/,FoodNYC
drecklia,"I think Ippudo and Totto are way overrated. Totto's bun is excellent, ramen no so much.

My favorite place is Menkui Tei at St Marks. However is currently under renovation.",1420998964.0,/r/FoodNYC/comments/2r97ps/ramen_in_nyc/cnllpyr/,FoodNYC
samtresler,"Fidi is a bit bereft. There is Ramen an Co. on Maiden Lane, other than that, there is an OK Korean Ramen up on church, I go to occasionally. ",1421025836.0,/r/FoodNYC/comments/2r97ps/ramen_in_nyc/cnm1euh/,FoodNYC
zombiekiller,"Green Curry Ramen at Bassanova

Spicy Chili Ramen at Ivan (LES)

Shio Ramen at Minca
",1421026084.0,/r/FoodNYC/comments/2r97ps/ramen_in_nyc/cnm1jek/,FoodNYC
ohmygondola,"Momofuku! lil pricey, and usually crowded but so so so worth it. the pork buns there are also phenomenal",1420337731.0,/r/FoodNYC/comments/2r97ps/ramen_in_nyc/cndoqzy/,FoodNYC
Ye_Olde_Mudder,"Best: [Ippudo at St Marks.  Nobody even comes close.](http://www.ippudony.com)

Very good: 

* [Totto for all the people who can't eat pork, mega ramen is best bang for buck in the city](http://tottoramen.com)
* [Hinata Ramen: Newly opened.](http://www.hinataramen.com)
* [Lucky Cat](http://www.luckycatnyc.com)
* [Nishida Sho-ten](http://nishidasho-ten.com)

~~Dead and gone: [Menkuitei, St Mark's Place](http://menkuitei.com/)~~ *Nam Myoho Renge Kyo...""

Astoria: [Hinomaru Ramen.  One of the best in the city but out of the way.   Take N,Q and walk or take the 69 bus.  Has lots of harder-to-find specials like Uni Ramen.](http://hinomaruramen.com/)
",1420421225.0,/r/FoodNYC/comments/2r97ps/ramen_in_nyc/cnencb5/,FoodNYC
dfmtr,"On top of Ippudo's ramen being better, the staff at Totto Ramen are choice assholes. I'll ascribe the general fuck-you attitude to Japanese snobbery, but I draw the line at making people wait longer on purpose to make the line grow out the door like a sleazy nightclub, with multiple open tables inside. NYC is not a smart place to assume your customers don't understand what you're saying to each other.",1421012802.0,/r/FoodNYC/comments/2r97ps/ramen_in_nyc/cnlu2yo/,FoodNYC
thansal,"So, I want to start a fight.  I really don't like Ippudo.  I think their ramen is about on par (really not as good) with Hide Chan (They both focus on tonkotsu), but it's %50 more expensive ($10 vs $15), and their pork buns are about on par w/ Hide Chan as well (Not Good), and they are about on par price wise with Momofuku's (Excellent).

Everything is about half again as expensive as I want to pay for the quality (if not more), and the crazy wait doesn't help.

My personal favorite is Hide Chan, I love tonkotsu ramen, and their Karage and dumplings are really good.

My recent discovery is Nishida Sho-ten, just a few blocks south of Hide Chan, and good.  Their prices are good at $10 for a bowl, and they often come with more of the extras (Egg, more Kakuni, etc).  Their Kakuni (and they have Kakuni instead of chashu, which is a bit different) can be really excellent.  I've also yet to run into a line there (aka, a good choice if Hide Chan and Toto have lines out the door).  Antoher plus is a nice range of broths (Pork, Chicken, vegie, and some combinations).

The downside is that their quality isn't as reliable.  There's a pretty big range on how well the kakuni has been cooked, and how the broth was.  I'm also not impressed with anything I've seen that wasn't ramen.

I agree with you on momofuku, not worth the extra money, stick to everything else on their menu (Which really is worth the extra money).  Ivan was really interesting, and one of the few fish based ramen shops in NYC that I know of (sadly, I don't like fish...).  I actually think they are pretty traditional iirc.  The only sorta odd thing is the use of Rye noodles.

Ninja addendum: I'm jealous of Seattle and it's abundance of cheap, good Pho.  It's almost as ubiquitous there as cheap pizza is here (and better!)",1421010891.0,/r/FoodNYC/comments/2r97ps/ramen_in_nyc/cnlsw8c/,FoodNYC
kuj0317,"Pho > Ramen.

Microphone = dropped.",1420355457.0,/r/FoodNYC/comments/2r97ps/ramen_in_nyc/cndxc5j/,FoodNYC
holla171,"Yep. 125 and Broadway right off the ""1"" stop.",1420387537.0,/r/FoodNYC/comments/2r97ps/ramen_in_nyc/cne5g97/,FoodNYC
Ye_Olde_Mudder,"I love this place.  
The regular menu is great, but the daily/weekly specials are something to look out for.

Seems to be getting packed on the weekend as more people discover it.

Tried Tamashi on Broadway but honestly they were a bowlful of meh and disappointment.",1420461257.0,/r/FoodNYC/comments/2r97ps/ramen_in_nyc/cnf1hjs/,FoodNYC
jackrandomsx,"If you like Hinomaru, they have a sister Izakaya (who serves some of their ramen as well) in Midtown on 53rd called Lucky Cat.",1421776389.0,/r/FoodNYC/comments/2r97ps/ramen_in_nyc/cnv3phq/,FoodNYC
fantasy_account,Ramen Misoya (also by st marks) has really good ramen and also vegetarian ramen. Highly recommended. http://www.misoyanyc.com/,1420564332.0,/r/FoodNYC/comments/2r97ps/ramen_in_nyc/cngaveg/,FoodNYC
penguinforpresident,"+1 for Minca!  Their dipping Ramen is fantastic
",1421175758.0,/r/FoodNYC/comments/2r97ps/ramen_in_nyc/cnntcwo/,FoodNYC
curiiouscat,Yes! I ordered from them all the time over the summer for take out. They were great and I totally stumbled across them by accident. ,1420999951.0,/r/FoodNYC/comments/2r97ps/ramen_in_nyc/cnlm9mn/,FoodNYC
nomnomfordays,"I came back from a trip to Japan where I ate ramen at least 5 times a week and I have to say that Mu Ramen does it right. Their miso ramen is legit, though the noodles have changed since inception (American palate didn't like their more authentic chewy noodles). If you recognize the names Gyogo, ichiran, or have been to Fukuoka, then Mu Ramen is worth checking out. 

Reservations are a bitch and it's cash only but if you're diligent you'll almost always get a seating that day 

Oh and their other Ravens are solid too but less authentic though equally dericious ",1421040344.0,/r/FoodNYC/comments/2r97ps/ramen_in_nyc/cnm8g9r/,FoodNYC
lieuline,I also really like Minca... probably more than ippudo. ,1421365889.0,/r/FoodNYC/comments/2r97ps/ramen_in_nyc/cnqc5zx/,FoodNYC
JestersXIII,Menkuitei is closed. ,1420432552.0,/r/FoodNYC/comments/2r97ps/ramen_in_nyc/cnetcqg/,FoodNYC
jgl2832,they just opened one on 82nd and amsterdam as well!,1421002064.0,/r/FoodNYC/comments/2r97ps/ramen_in_nyc/cnlni6v/,FoodNYC
drjimmybrungus,What did you get at Tamashii? I wasn't thrilled with their shoyu ramen but I really love their kara miso ramen. If you ever go back I'd recommend you try that one.,1421542720.0,/r/FoodNYC/comments/2r97ps/ramen_in_nyc/cnsdzs9/,FoodNYC
Siette,"They're so wonderful! I've brought people there who've been to Ippudo and they've said it was much, much better. I actually found out about it from a coworker who wanted to find the best ramen in the LES/East Village area so she would go to every. single. restaurant. until she found Zen 6.",1421010651.0,/r/FoodNYC/comments/2r97ps/ramen_in_nyc/cnlsquq/,FoodNYC
Ye_Olde_Mudder,I has a sad...,1420461034.0,/r/FoodNYC/comments/2r97ps/ramen_in_nyc/cnf1fma/,FoodNYC
kilmore_trout,This is great news.,1421037670.0,/r/FoodNYC/comments/2r97ps/ramen_in_nyc/cnm78ul/,FoodNYC
curiiouscat,"Yes! I tried a bunch of different Ramen places around the area, but eventually I gave up and started serially ordering from Zen 6. I've never met anyone who's ever heard of them before lol. I'm glad I'm not alone. ",1421011556.0,/r/FoodNYC/comments/2r97ps/ramen_in_nyc/cnltbrt/,FoodNYC
SchAmToo,Mu Ramen should be in this post! (LIC),1454107419.0,/r/FoodNYC/comments/43ahnq/the_best_ramen_places_in_nyc/czgygf6/,FoodNYC
linsage,Awesome. Yes. Good post. ,1454103129.0,/r/FoodNYC/comments/43ahnq/the_best_ramen_places_in_nyc/czgvmku/,FoodNYC
