author,body,created_utc,permalink,subreddit
PPPIGGY,I'm scratching my head as to why Bassanova is here. Among the worst ramens I've had!,1454162360.0,/r/FoodNYC/comments/43ahnq/the_best_ramen_places_in_nyc/czhj9al/,FoodNYC
thingthangnyc,"I'm sorry but Momofuku Noodle Bar is legit.  I've eaten ramen all over the world, in Japan a dozen or so times... Momofuku does it.  Honorable mention: Rai Rai Ken",1454118207.0,/r/FoodNYC/comments/43ahnq/the_best_ramen_places_in_nyc/czh4lfm/,FoodNYC
mrjackson28,Ramen Zundo-ya ,1454933447.0,/r/FoodNYC/comments/43ahnq/the_best_ramen_places_in_nyc/czs4azf/,FoodNYC
SuperPoop,ippudo?,1454128413.0,/r/FoodNYC/comments/43ahnq/the_best_ramen_places_in_nyc/czh9hn0/,FoodNYC
thefranster,So glad frigging ippudo isn't on here. ,1454111482.0,/r/FoodNYC/comments/43ahnq/the_best_ramen_places_in_nyc/czh0wya/,FoodNYC
thefranster,mu is pretty great- but I wouldn't say it stands against the ones mentioned here. It's also too hard to get in to compared to how good the food is. Overall based on entire experience it's a 3/5 for me. ,1454111469.0,/r/FoodNYC/comments/43ahnq/the_best_ramen_places_in_nyc/czh0woq/,FoodNYC
Rufffmuff,I completely agree. You expect food bloggers to venture out of Brooklyn or Manhattan?,1454112076.0,/r/FoodNYC/comments/43ahnq/the_best_ramen_places_in_nyc/czh19fh/,FoodNYC
GraphicNovelty,Strongly disagree. Bassanovas green curry ramen is my second favorite dish in NYC (behind Shanghai cafe soup dumplings) ,1454610111.0,/r/FoodNYC/comments/43ahnq/the_best_ramen_places_in_nyc/cznt3a5/,FoodNYC
Kenrr,"I'm a huge fan of David Chang, especially after watching season 1 of Mind of a Chef and what goes into the food. However Momofuku Noodle Bar is over-rated and is not that good in comparison to the list and other Ramen places. Last time I was there was about 2 years ago so maybe things have change. Rai Rai Ken is pretty good.

My personal favorite Ramen place out of all would be Hide-Chan.  ",1454125399.0,/r/FoodNYC/comments/43ahnq/the_best_ramen_places_in_nyc/czh8468/,FoodNYC
thansal,"Isn't particularly special and over priced.

Check out Hide-Chan, I think their Tonkotsu (what they are both specialists in) is better than ippudo (though not by much) and reasonably cheaper.",1454155045.0,/r/FoodNYC/comments/43ahnq/the_best_ramen_places_in_nyc/czhh7rt/,FoodNYC
GraphicNovelty,"Great pork buns, ok ramen",1454610126.0,/r/FoodNYC/comments/43ahnq/the_best_ramen_places_in_nyc/cznt3oq/,FoodNYC
thansal,"A redditor after my own heart.

I agree with you on Noodle bar's ramen, it's not particularly interesting despite the good ideas that go into it.  It's just good solid ramen, but at that price, I want more than good solid ramen.  The rest of the menu is fantastic.  Child Spicy Noodles are one of my ""I could eat this every day for the rest of my life and be happy"" dishes.

And yes, Hide-Chan is the best Tonkotsu ramen I've had, and as that's my favorite type of ramen, it ranks in first for me.",1454154995.0,/r/FoodNYC/comments/43ahnq/the_best_ramen_places_in_nyc/czhh7d3/,FoodNYC
thingthangnyc,"Haven't been to Hide Chan... after reading some reviews seems like a must try.  Thanks!

Edit:  I've only been to Noodle Bar 3 times, all within the last 2 years.  Maybe I've lucked out.",1454174574.0,/r/FoodNYC/comments/43ahnq/the_best_ramen_places_in_nyc/czhp0yd/,FoodNYC
yokuyuki,"Personal ranking:

1. Zundo-ya

2. Mu

3. Minca
",1517682266.0,/r/AskNYC/comments/7v0vbf/best_ramen_in_the_city_stickied_post_is_5_years/dtonlu8/,AskNYC
boycott_nestingdolls,"Jin Ramen is solid

ROKC is great if you want to venture uptown ",1517681673.0,/r/AskNYC/comments/7v0vbf/best_ramen_in_the_city_stickied_post_is_5_years/dton2qd/,AskNYC
k_pang,toto’s and ippudo are my go-tos,1517681015.0,/r/AskNYC/comments/7v0vbf/best_ramen_in_the_city_stickied_post_is_5_years/dtomgxw/,AskNYC
Weizenbock,"I like Mu - mainly because it's walking distance from my apartment, but it definitely is pretty highly rated.",1517680804.0,/r/AskNYC/comments/7v0vbf/best_ramen_in_the_city_stickied_post_is_5_years/dtoma7g/,AskNYC
SirLudicrus,"Nishida shoten is one of my favorites. Unfussy, cozy, hits the spot taste wise, not too expensive, fun staff.",1517695676.0,/r/AskNYC/comments/7v0vbf/best_ramen_in_the_city_stickied_post_is_5_years/dtoywih/,AskNYC
prophetsavant,"Chuko and Yebisu are my favorites in Brooklyn. The vegan ramen at Chuko might be the strongest think on the menu, no joke.",1517685542.0,/r/AskNYC/comments/7v0vbf/best_ramen_in_the_city_stickied_post_is_5_years/dtoqg3i/,AskNYC
DC25NYC,"Chuko, ganso and hide chan",1517688750.0,/r/AskNYC/comments/7v0vbf/best_ramen_in_the_city_stickied_post_is_5_years/dtot5lm/,AskNYC
psychopooch,"Hide-Chan, Totto, Minca and Nakamura are my favorites. Ivan is popular but it’s a miss for me. I love Ippudo’s broth but not crazy about the noodle itself since I prefer ramen with a bit more chew. But the latter 2 ramen places seems to get recommended often. ",1517689195.0,/r/AskNYC/comments/7v0vbf/best_ramen_in_the_city_stickied_post_is_5_years/dtotiz2/,AskNYC
Mumbojmbo,"Chuko is hands down my favorite, but Momofuku Noodle is bomb too - though I like Momo more for the other dishes (their cucumber salad is incredible, I've never had anything like it).  
  
Edit: Chuko is also great for groups/birthdays - lots of times the best ramen places are counter service or hole-in-the-wall tiny, which is great but not real conducive to drinks. I've also found a lot of ramen places to not have much as far as adult beverages go. Chuko has great space and delish drinks, too. Just mentioning!",1517683872.0,/r/AskNYC/comments/7v0vbf/best_ramen_in_the_city_stickied_post_is_5_years/dtop0bj/,AskNYC
ruskibaby,"Sapporo is my all time favorite - it's on 49th and 7th, I believe. Ivan's Ramen is also a good choice.",1517682015.0,/r/AskNYC/comments/7v0vbf/best_ramen_in_the_city_stickied_post_is_5_years/dtondsx/,AskNYC
Empath1999,My favorite is ippudo.,1517699730.0,/r/AskNYC/comments/7v0vbf/best_ramen_in_the_city_stickied_post_is_5_years/dtp27bj/,AskNYC
allfurcoatnoknickers,"Mu, closely followed by Jun-men in Chelsea. ",1517699172.0,/r/AskNYC/comments/7v0vbf/best_ramen_in_the_city_stickied_post_is_5_years/dtp1raq/,AskNYC
potatomato33,"Tonkatsu: Zundo-ya on 10th between 3rd and 4th, around the corner from Ippudo.

Miso: Tamashii Ramen in Astoria, on Broadway between 29th and 39th St.",1517747576.0,/r/AskNYC/comments/7v0vbf/best_ramen_in_the_city_stickied_post_is_5_years/dtpue1r/,AskNYC
chuckdizzle78,"1. Zundo-Ya
2. Zurutto
3. Ippudo",1517695917.0,/r/AskNYC/comments/7v0vbf/best_ramen_in_the_city_stickied_post_is_5_years/dtoz3fp/,AskNYC
welkstar,Kogane in Brooklyn Heights,1517711949.0,/r/AskNYC/comments/7v0vbf/best_ramen_in_the_city_stickied_post_is_5_years/dtpbx99/,AskNYC
LustfulGranola,Noodle Folk on the UES is my go-to every time. Bless the noods. ,1517721906.0,/r/AskNYC/comments/7v0vbf/best_ramen_in_the_city_stickied_post_is_5_years/dtpj9mz/,AskNYC
114631,"I’ve had ramen from about eight different places in the city and my favorites are Ippudo and a place on the UWS called Izakaya Ida. The latter one is beautifully rich and delicious. I was surprised how good it was. Eventually I’d like to try Mu Ramen, Ivan, Ichiran, and Shuya.",1517752345.0,/r/AskNYC/comments/7v0vbf/best_ramen_in_the_city_stickied_post_is_5_years/dtpwl45/,AskNYC
Diplomatt_,Naruto ramen is mine. ,1517683566.0,/r/AskNYC/comments/7v0vbf/best_ramen_in_the_city_stickied_post_is_5_years/dtooqm4/,AskNYC
prophetsavant,"Chuko and Yebisu are my favorites in Brooklyn. The vegan ramen at Chuko might be the strongest think on the menu, no joke.",1517685576.0,/r/AskNYC/comments/7v0vbf/best_ramen_in_the_city_stickied_post_is_5_years/dtoqh4a/,AskNYC
eldubyar,"Not sure how it ranks on a city-wide scale, but shout out to Nana Ramen on Malcolm X",1517696979.0,/r/AskNYC/comments/7v0vbf/best_ramen_in_the_city_stickied_post_is_5_years/dtozyf7/,AskNYC
xconzo,Definitely check out Tonchin. Opened a few months ago but it's the best ramen I've had anywhere.,1517708945.0,/r/AskNYC/comments/7v0vbf/best_ramen_in_the_city_stickied_post_is_5_years/dtp9ikx/,AskNYC
-star67,"RYUJIN in Williamsburg, 513 Grand St. Brooklyn",1517712138.0,/r/AskNYC/comments/7v0vbf/best_ramen_in_the_city_stickied_post_is_5_years/dtpc2xv/,AskNYC
themassiah,Kinjo in Brooklyn is pretty great.,1517717570.0,/r/AskNYC/comments/7v0vbf/best_ramen_in_the_city_stickied_post_is_5_years/dtpg8td/,AskNYC
Usrname52,Can someone suggest a place that specifically has a good vegetarian ramen? Not Brooklyn.,1517720786.0,/r/AskNYC/comments/7v0vbf/best_ramen_in_the_city_stickied_post_is_5_years/dtpiij1/,AskNYC
samili,Anyone got reccomensations for vegan ramen?,1517768006.0,/r/AskNYC/comments/7v0vbf/best_ramen_in_the_city_stickied_post_is_5_years/dtq8ns4/,AskNYC
NeedsMoreSauce,There are so many styles and taste is subjective.,1517688027.0,/r/AskNYC/comments/7v0vbf/best_ramen_in_the_city_stickied_post_is_5_years/dtosk8c/,AskNYC
dcha,+1 Zundo-ya,1517705281.0,/r/AskNYC/comments/7v0vbf/best_ramen_in_the_city_stickied_post_is_5_years/dtp6mfw/,AskNYC
potatomato33,"Zundo-ya is the absolute best. Don't know why people wait on line at Ippudo when Zundo-ya is right around the corner (which is how I first discovered it for myself).

Mu is disappointing for me, and that's coming from someone whose good friend has a stake in it.

Have to try Minca.",1517747376.0,/r/AskNYC/comments/7v0vbf/best_ramen_in_the_city_stickied_post_is_5_years/dtpub8t/,AskNYC
HerbsaintLaurent,Zundo-ya is superb. Love that they let you choose the fattiness of your broth. A+++,1517723608.0,/r/AskNYC/comments/7v0vbf/best_ramen_in_the_city_stickied_post_is_5_years/dtpkdrc/,AskNYC
Swimmingindiamonds,I have a soft spot for Minca.,1517720434.0,/r/AskNYC/comments/7v0vbf/best_ramen_in_the_city_stickied_post_is_5_years/dtpi9q7/,AskNYC
spoon_sporkforker,They also have great oysters at ROKC ($1.50 happy hour) and their cocktails are out of this s world,1517750975.0,/r/AskNYC/comments/7v0vbf/best_ramen_in_the_city_stickied_post_is_5_years/dtpvvnu/,AskNYC
bustygold,"Mine too, but I didn't know if a new amazing place had opened in the past 5 years. Ippudo probably seems like the best choice. ",1517681510.0,/r/AskNYC/comments/7v0vbf/best_ramen_in_the_city_stickied_post_is_5_years/dtomxax/,AskNYC
MrDannyOcean,"Piggybacking this comment for the midtown west crowd:

A newer ramen shop in Hell's Kitchen is Mentoku on 9th Ave and 50th.  It's awesome and it's also not yet as crazy popular as places like Totto, so there's no waiting in line.  Try the spicy option, it's great.",1517739431.0,/r/AskNYC/comments/7v0vbf/best_ramen_in_the_city_stickied_post_is_5_years/dtprf1g/,AskNYC
mlurve,+1 for Mu. Also important note—it’s cash only!,1517698483.0,/r/AskNYC/comments/7v0vbf/best_ramen_in_the_city_stickied_post_is_5_years/dtp16ut/,AskNYC
IvoShandor,Sapporo closed.,1517685276.0,/r/AskNYC/comments/7v0vbf/best_ramen_in_the_city_stickied_post_is_5_years/dtoq7tx/,AskNYC
curiiouscat,Sapporo closed recently :(,1517685358.0,/r/AskNYC/comments/7v0vbf/best_ramen_in_the_city_stickied_post_is_5_years/dtoqac7/,AskNYC
bustygold,Ivan Ramen is so good. The triple pork triple garlic ramen is amazing. ,1517682338.0,/r/AskNYC/comments/7v0vbf/best_ramen_in_the_city_stickied_post_is_5_years/dtono48/,AskNYC
le_suck,sapporo and sake bar hagi closed a few weeks ago due to an issue with the building :( edit: [link](http://www.grubstreet.com/2018/01/sapporo-sake-bar-hagi-iroha-nyc-closing.html),1517695195.0,/r/AskNYC/comments/7v0vbf/best_ramen_in_the_city_stickied_post_is_5_years/dtoyih5/,AskNYC
drjimmybrungus,I mentioned this in a reply to another comment above but fuck yes Tamashii is awesome. Their kara miso ramen might be my favorite bowl of ramen in the entire city.,1517847241.0,/r/AskNYC/comments/7v0vbf/best_ramen_in_the_city_stickied_post_is_5_years/dtrw1qj/,AskNYC
Jexy84,"Yeah, that’s a nice little spot. The pork jowl in the tonkotsu ramen is great.",1517759509.0,/r/AskNYC/comments/7v0vbf/best_ramen_in_the_city_stickied_post_is_5_years/dtq16uy/,AskNYC
PicksYourNose,In park slope? I always pass by it but haven't tried. ,1517685501.0,/r/AskNYC/comments/7v0vbf/best_ramen_in_the_city_stickied_post_is_5_years/dtoqeut/,AskNYC
psychopooch,Can give Ramen Ishida in the LES a try.,1517747532.0,/r/AskNYC/comments/7v0vbf/best_ramen_in_the_city_stickied_post_is_5_years/dtpudg1/,AskNYC
Lemonyhampeapasta,Ramen Shack,1517844488.0,/r/AskNYC/comments/7v0vbf/best_ramen_in_the_city_stickied_post_is_5_years/dtrtfgl/,AskNYC
xXKilltheBearXx,"I third this, these are my top two. But also a shout out to my hood, Astoria for upping there ramen game is recent years.",1517715317.0,/r/AskNYC/comments/7v0vbf/best_ramen_in_the_city_stickied_post_is_5_years/dtpekzb/,AskNYC
ruskibaby,"omg no :((( this makes me so sad, i’ve been going there years and years. time to hunt for a new favorite :(",1517687827.0,/r/AskNYC/comments/7v0vbf/best_ramen_in_the_city_stickied_post_is_5_years/dtose7q/,AskNYC
ruskibaby,"have you seen the episode about him on Chef's Table? that led me to his ramen shop, but his story is also pretty cool and he seems like a genuinely nice guy!",1517682654.0,/r/AskNYC/comments/7v0vbf/best_ramen_in_the_city_stickied_post_is_5_years/dtony99/,AskNYC
Diplomatt_,I go to one in UES. Possibly related though. ,1517689282.0,/r/AskNYC/comments/7v0vbf/best_ramen_in_the_city_stickied_post_is_5_years/dtotlj0/,AskNYC
offlein,"I thought the park slope one was pretty good. It has actually naruto things (""narutomaki"", I guess?) in the ramen, which is a bare minimum requirement in my mind that real shitty places never have. So it's got at least that. ... There's your ringing endorsement.

...I say go in.",1517722433.0,/r/AskNYC/comments/7v0vbf/best_ramen_in_the_city_stickied_post_is_5_years/dtpjmms/,AskNYC
yokuyuki,Which is the best in Astoria?,1517756057.0,/r/AskNYC/comments/7v0vbf/best_ramen_in_the_city_stickied_post_is_5_years/dtpyr6p/,AskNYC
ahyatt,"With luck, it may reopen. The building is getting structural upgrades, so it's not like they couldn't make the business work. 

https://ny.eater.com/platform/amp/2018/1/9/16868208/sapporo-sake-bar-hagi-iroha-closing-nyc",1517705299.0,/r/AskNYC/comments/7v0vbf/best_ramen_in_the_city_stickied_post_is_5_years/dtp6my8/,AskNYC
IvoShandor,"Hide Chan has a two good spots in midtown, one East 49 (i think) and one West 53 St.",1517709275.0,/r/AskNYC/comments/7v0vbf/best_ramen_in_the_city_stickied_post_is_5_years/dtp9rtz/,AskNYC
bustygold,Honestly my friend and I just stumbled in there on a whim and were so impressed with it. I'll check it out though. ,1517687062.0,/r/AskNYC/comments/7v0vbf/best_ramen_in_the_city_stickied_post_is_5_years/dtorr2t/,AskNYC
bustygold,"They are. I've been there before, pretty good. I'm in East Harlem so it's one of the closer places to me. ",1517724005.0,/r/AskNYC/comments/7v0vbf/best_ramen_in_the_city_stickied_post_is_5_years/dtpkm96/,AskNYC
drjimmybrungus,"Tamashii Ramen on Broadway is my favorite, and not just in Astoria but out of everywhere I've had ramen in the city. Their kara miso ramen is fantastic. 

Hinomaru up on Ditmars is also very good and I've heard good things about Shuya on Broadway but haven't tried that myself yet.",1517847068.0,/r/AskNYC/comments/7v0vbf/best_ramen_in_the_city_stickied_post_is_5_years/dtrvvkz/,AskNYC
Lemonyhampeapasta,Hinomaru is the only one I have consistently gone to monthly in the past five years. I have gone to all the ramen shops in the LIC/Astoria area at least twice. My standards are whether the tonkatsu and shio ramen are worth ordering again before I go for the more adventurous ramen. Hinomaru is the only one that consistently hits the spot. ,1517772354.0,/r/AskNYC/comments/7v0vbf/best_ramen_in_the_city_stickied_post_is_5_years/dtqd35l/,AskNYC
terminal-chillness,Seconding Tamashii! The tantanmen is really dope too,1517849872.0,/r/AskNYC/comments/7v0vbf/best_ramen_in_the_city_stickied_post_is_5_years/dtrypbo/,AskNYC
TheMiddleBeast,"I used to work at a ramen shop up in Westchester thats cheaper than most city spots. Ramen Musashi, basic bowl is like $10, recently voted best ramen in westchester if anyone is down for a drive for ramen ",1507567464.0,/r/nyc/comments/752ze3/best_ramen_noodles_in_new_york_new_york_city/do4l487/,nyc
unironicneoliberal,I love Mike! His videos always make me drool,1507484095.0,/r/nyc/comments/752ze3/best_ramen_noodles_in_new_york_new_york_city/do308ag/,nyc
BenedictKhanberbatch,I just went to Misoya this weekend and I loved their vegetarian spicy kome ramen. Great bowl for just 12 bucks. ,1507569860.0,/r/nyc/comments/752ze3/best_ramen_noodles_in_new_york_new_york_city/do4nh1a/,nyc
kuyakew,Ramen Shack in Queensbridge is the best.,1507562209.0,/r/nyc/comments/752ze3/best_ramen_noodles_in_new_york_new_york_city/do4g8ld/,nyc
,"LOL, WTF those Ippudo prices are nearly DOUBLE those of Tokyo & Taiwan.
Shit are so fucking expensive in NY it's pathetic.

That's one thing that makes me find it hard to understand what makes NYC an attractive tourist destination. (other than ""*well, it's NYC !!! AMERICA !!!*"")

Conversely it makes my foreign trips so much more enjoyable because things seem cheaper comparing to what I'd otherwise have to pay for in NYC. ",1507488627.0,/r/nyc/comments/752ze3/best_ramen_noodles_in_new_york_new_york_city/do34ehd/,nyc
lost_in_life_34,There is some place around 10th and 24th that I like. It's $16 so I don't go there a lot but well worth it,1507554954.0,/r/nyc/comments/752ze3/best_ramen_noodles_in_new_york_new_york_city/do4alah/,nyc
George_Kushstanza,Temporarily closed. ,1507690995.0,/r/nyc/comments/752ze3/best_ramen_noodles_in_new_york_new_york_city/do7a0jy/,nyc
rco8786,"Are you telling me New York is expensive?  Color me skeptical... /s

In all seriousness there’s tons of good cheap ramen in the city. Ippudo bills itself as upscale and charges upscale prices.",1507526384.0,/r/nyc/comments/752ze3/best_ramen_noodles_in_new_york_new_york_city/do3ypi3/,nyc
jdlyga,Well yeah but some people live here and just want some ramen. I’d gladly visit Japan but it’s far away. ,1507493142.0,/r/nyc/comments/752ze3/best_ramen_noodles_in_new_york_new_york_city/do38olx/,nyc
T-Bills,"NYC does offer authentic cuisine from many countries, overpriced or not. There are only a handful of cities on this continent that offers that. 

But I'm with you. Fuck those bland shitty $8+ midtown deli sandwiches. ",1507515907.0,/r/nyc/comments/752ze3/best_ramen_noodles_in_new_york_new_york_city/do3rlby/,nyc
z0rb0r,How much is it? Tamashii ramen in Astoria typically runs around 12-14 bucks for some ramen.,1507500577.0,/r/nyc/comments/752ze3/best_ramen_noodles_in_new_york_new_york_city/do3fbav/,nyc
CatOfThePole,"on the one hand, great $8 dollar ramen

on the other hand, mediocre pizza for $5 a slice

if only we could somehow have both good, cheap ramen and good, cheap pizza in one place...

^(in related news I miss the place near me that used to do a tolerable ramen for $6)",1507517270.0,/r/nyc/comments/752ze3/best_ramen_noodles_in_new_york_new_york_city/do3sna6/,nyc
kuyakew,"They're basically only open on weekdays for 4 hours at a time and randomly closed based on God-knows-what. New York's most frustrating restaurant. Still, the ramen is the best. Closest I've been to the style of ramen I love in Japan.",1507721547.0,/r/nyc/comments/752ze3/best_ramen_noodles_in_new_york_new_york_city/do7o2x9/,nyc
,"> tons of good cheap ramen

like ? anyway I doubt they will be good.",1507583920.0,/r/nyc/comments/752ze3/best_ramen_noodles_in_new_york_new_york_city/do517in/,nyc
RoboticParadox,Brown rice and some meat cubes eh? That'll be 11 smackers.,1507563538.0,/r/nyc/comments/752ze3/best_ramen_noodles_in_new_york_new_york_city/do4hfyb/,nyc
,"In Tokyo from what I know of: between $5 ~ $9, so basically half of NY. Even in out-of-way Queens & Jersey City the prices are rather high.",1507507592.0,/r/nyc/comments/752ze3/best_ramen_noodles_in_new_york_new_york_city/do3ky6r/,nyc
rco8786,$5 a slice? Have you ever been to NYC?,1507525851.0,/r/nyc/comments/752ze3/best_ramen_noodles_in_new_york_new_york_city/do3yfkk/,nyc
rco8786,"Kambi ($12), Rai Rai Ken ($11-12) Thukpa ($10), Minca ($12), Zen 6 ($11), Misoya ($11) 

That's just off the top of my head, and not even leaving lower manhattan where it just gets cheaper.  You've obviously made up your mind though, so have a good one.",1507592486.0,/r/nyc/comments/752ze3/best_ramen_noodles_in_new_york_new_york_city/do58l1q/,nyc
BenedictKhanberbatch,Percy's on Bleecker best dollar slice in the city and I'll fight to the death to defend that ,1507569805.0,/r/nyc/comments/752ze3/best_ramen_noodles_in_new_york_new_york_city/do4nf1n/,nyc
CatOfThePole,"I have. It's a city with great, cheap pizza and very expensive ramen.

Have you ever been to tokyo?",1507550441.0,/r/nyc/comments/752ze3/best_ramen_noodles_in_new_york_new_york_city/do482bk/,nyc
rco8786,No and I'm not saying anything about tokyo. $5 a slice is *outrageous* in NYC. $1-2 on every corner.,1507568083.0,/r/nyc/comments/752ze3/best_ramen_noodles_in_new_york_new_york_city/do4lq4p/,nyc
capslockfury,"Hmm, I think he means that it's $5 a slice in Tokyo, so the inverse is true for Tokyo. 

i.e. we pay 12-15 dollars for Ramen and 1-2 for Pizza
Tokyo pays 8 dollars for ramen and 5 for pizza",1507569795.0,/r/nyc/comments/752ze3/best_ramen_noodles_in_new_york_new_york_city/do4neoh/,nyc
,"> $1-2 on every corner.

in some ghettos in Bklyn/Bronx maybe. $2.5 ~ $3.25 is the NYC average i think.",1507584096.0,/r/nyc/comments/752ze3/best_ramen_noodles_in_new_york_new_york_city/do51dp8/,nyc
rco8786,"Gotcha, that makes more sense though I'm still not getting it via context. Oh well.",1507575089.0,/r/nyc/comments/752ze3/best_ramen_noodles_in_new_york_new_york_city/do4slc5/,nyc
,"umm for $5 in tokyo you don't get a slice (it's not the thing there), you get a personal pie.",1507584179.0,/r/nyc/comments/752ze3/best_ramen_noodles_in_new_york_new_york_city/do51gje/,nyc
rco8786,".. You couldn't be more wrong, unfortunately.",1507591822.0,/r/nyc/comments/752ze3/best_ramen_noodles_in_new_york_new_york_city/do581cc/,nyc
capslockfury,"The OP he's replying to is saying Ramen is double the price in NYC. His counterpoint is basically saying ""Yeah, Ramen is double, but you have cheap pizza, as we have cheap ramen but double the price pizza."" ",1507575914.0,/r/nyc/comments/752ze3/best_ramen_noodles_in_new_york_new_york_city/do4tde6/,nyc
capslockfury,¯\_(ツ)_/¯  I mean okay. I've never had pizza in Tokyo. Only ramen. I'm just trying to make sense of the comment. ,1507587310.0,/r/nyc/comments/752ze3/best_ramen_noodles_in_new_york_new_york_city/do5498c/,nyc
CatOfThePole,"yeah I'm not saying a cheap pizza doesn't exist (although I will cast doubts on its quality) ^(the cheap nyc ramen exists too, but it's also not on par)

but the 500Y (okay so maybe like $4.5 depending on exchange) pizza slice does exist. I went to this kind of surreal faux new york pizza restaurant and it was so close and yet so far from the actual thing that it really kinda weirded me out",1507645914.0,/r/nyc/comments/752ze3/best_ramen_noodles_in_new_york_new_york_city/do655vh/,nyc
Hobo_Stabbing_Bridge,"You dropped this:

 \",1507610310.0,/r/nyc/comments/752ze3/best_ramen_noodles_in_new_york_new_york_city/do5nm33/,nyc
