author,body,created_utc,permalink,subreddit
slamjam00,"Not sure how no one has mentioned ROKC. Incredible pork buns, great ramen, voted best cocktails in the country by Esquire recently (just Google rokc cocktails and look at the pics) and it's not as pricey as others. I've been to almost every other place mentioned on here and none of them come close. Only downside is it's on the upper west side, so it's not easy to get to. It's also a small place, so get there early to grab a table. ",1538783646.0,/r/AskNYC/comments/9lmkh6/great_ramen_suggestions_please_d/e78vxlm/,AskNYC
Woodybroadway,"Mu is the best in my opinion, better than anywhere I went in Japan.

Ippudo is my first love, probably better for a bday but busy, go to the one downtown

Okanomi has a ramen tasting menu if you wanna through  down real money and reserve in advance, good ambiance.

Momofuku is probably the trendiest and has a lot more than ramen (they popularized it) def fun for a bday.

Oh and Iven has good bday vibes and good for a trendy meal.",1538783956.0,/r/AskNYC/comments/9lmkh6/great_ramen_suggestions_please_d/e78w8ui/,AskNYC
relativisticrhino,"I’ve been trying out ramen shops around NYC and Ramen Ya by NYU is definitely the best! Rich tasting broth, sturdy noodles (none of that soggy instant shit some restaurants use), reasonable price more or less.

The store owners and cooks are actually Japanese which I feel explains the authenticity. They only accept cash tho ",1538751648.0,/r/AskNYC/comments/9lmkh6/great_ramen_suggestions_please_d/e77uvcs/,AskNYC
mcorinne,Jin Ramen in the UWS is the best,1538753414.0,/r/AskNYC/comments/9lmkh6/great_ramen_suggestions_please_d/e77wzvx/,AskNYC
omiaguirre,"I love Ivan Ramen 

https://www.ivanramen.com/",1538749258.0,/r/AskNYC/comments/9lmkh6/great_ramen_suggestions_please_d/e77s0gc/,AskNYC
WhatAreYouWhereAmI,Nakamura in the lower east.,1538752238.0,/r/AskNYC/comments/9lmkh6/great_ramen_suggestions_please_d/e77vkmd/,AskNYC
,NAKAMURA . Tontoro is my shit.,1538753472.0,/r/AskNYC/comments/9lmkh6/great_ramen_suggestions_please_d/e77x2gc/,AskNYC
cerrasaurus,Suzume in Brooklyn.,1538754712.0,/r/AskNYC/comments/9lmkh6/great_ramen_suggestions_please_d/e77yl4y/,AskNYC
gyrk12,Tonchin in Midtown!!,1538754754.0,/r/AskNYC/comments/9lmkh6/great_ramen_suggestions_please_d/e77yn28/,AskNYC
bkeiya,"Shuya Cafe De Ramen, Tanpopo Ramen, Ramen Shack, Hide-Chan Ramen, and Ippudo are my go tos!",1538754833.0,/r/AskNYC/comments/9lmkh6/great_ramen_suggestions_please_d/e77yqn2/,AskNYC
pandaminatrix,"I've only had ramen in the city literally once (I know, I know), which was at Tampopo near Washington Heights, and it was wonderful. 

Some visiting friends tried both Ippudo and Tampopo during their stay, and they actually preferred Tampopo. ",1538762875.0,/r/AskNYC/comments/9lmkh6/great_ramen_suggestions_please_d/e788l1d/,AskNYC
dounis42,"Santouka, over in the Mitsuwa food court in Edgewater - not a great spot for a date (it being a food court), but you should give it a try sometime! As for a spot that's appropriate for a date, I would definitely throw in another vote for Totto Ramen.",1538764204.0,/r/AskNYC/comments/9lmkh6/great_ramen_suggestions_please_d/e78a6yl/,AskNYC
kodachromeexplorer,I absolutely love ROKC - it’s an oyster bar and ramen spot with great cocktails too. Broadway btw 140 & 141,1538793963.0,/r/AskNYC/comments/9lmkh6/great_ramen_suggestions_please_d/e795c4f/,AskNYC
apreche,HinoMaru in Astoria.,1538750800.0,/r/AskNYC/comments/9lmkh6/great_ramen_suggestions_please_d/e77tu41/,AskNYC
zerowingangel,"Nonono Lunch menu Paitan Ramen. recently opened last month. Reasonable price, great ramen",1538752084.0,/r/AskNYC/comments/9lmkh6/great_ramen_suggestions_please_d/e77ve0i/,AskNYC
Lost_sidhe,"Ichiran will get you the most ""Just like in Tokyo"" experience, but I honestly think E.A.K. Ramen in the West Village has some of the best tasting ramen in the city (get the zebra with black garlic oil!!!).  When I finally got in, I found Ippudo not good enough to justify the extra wait and cost compared to other really good ramen places.  And I'll second Chuko in Bushwick especially for their chicken ramen; but their tonkatsu is good, not OMG! ",1538752795.0,/r/AskNYC/comments/9lmkh6/great_ramen_suggestions_please_d/e77w8q8/,AskNYC
patientbearr,"All of the places listed are great, but I'll throw in Minca in the East Village since no one has mentioned it yet",1538754031.0,/r/AskNYC/comments/9lmkh6/great_ramen_suggestions_please_d/e77xqx0/,AskNYC
Yanboslice,Zundo Ya,1538760546.0,/r/AskNYC/comments/9lmkh6/great_ramen_suggestions_please_d/e785q1a/,AskNYC
Kevin_Johnston,"Totto, Mr. Taka, Terakawa",1538762315.0,/r/AskNYC/comments/9lmkh6/great_ramen_suggestions_please_d/e787wj9/,AskNYC
meelar,"Takashi is a Japanese steakhouse in the West Village, but every Friday and Saturday late night they have a beef ramen seating.  It's incredibly delicious.",1538764663.0,/r/AskNYC/comments/9lmkh6/great_ramen_suggestions_please_d/e78aqg9/,AskNYC
iampreferd,"there is a spot in brooklyn that nobody knows about. No wait time, totally hidden, undweer the radar still. It is called Zaya Ramen and it is fantastic. They do a beef bone marrow broth that just coats ur mouth. It is really really really good. Worth the trip.",1538765142.0,/r/AskNYC/comments/9lmkh6/great_ramen_suggestions_please_d/e78bb3q/,AskNYC
playaspec,"If you find yourself in Brooklyn near Barclay's Center, Naruto Ramen is *fantastic*.",1538768560.0,/r/AskNYC/comments/9lmkh6/great_ramen_suggestions_please_d/e78fkuf/,AskNYC
FrostbiteZero,"Minca in the East village is my favorite. I am bias since I live near by and have gotten used to and love the flavor of their rich soup. But regardless of soup they have the best noodle in town, chewy and full bodied.",1538770955.0,/r/AskNYC/comments/9lmkh6/great_ramen_suggestions_please_d/e78ilaf/,AskNYC
FrostbiteZero,"Bassanova in Chinatown is also interesting. Especially their curry ramen, really thick and full bodied noodle (it's my thing) and a really rich green curry soup. It's more or an off the beaten path choice but still very enjoyable. Plus I think the line is not as bad as it use to be.",1538771831.0,/r/AskNYC/comments/9lmkh6/great_ramen_suggestions_please_d/e78jmj5/,AskNYC
RefreshRestart,Boru Boru on the Upper West Side is aight,1538776348.0,/r/AskNYC/comments/9lmkh6/great_ramen_suggestions_please_d/e78oo8p/,AskNYC
BernieForWi,I’m surprised more people aren’t saying Ippudo. The Akamaru modern is one of the best dishes I have ever eaten tbh ,1538780524.0,/r/AskNYC/comments/9lmkh6/great_ramen_suggestions_please_d/e78svus/,AskNYC
clk1224,I cannot believe no one has mentioned Chuko. It’s in BK but I go there regularly and I live in FiDi. Worth it. So so good. ,1538781099.0,/r/AskNYC/comments/9lmkh6/great_ramen_suggestions_please_d/e78tgc0/,AskNYC
FoolOnThePlanet91,"8 years in nyc, may favorite is still Hide-Chan on 52nd btw 2nd and 3rd. Ive been to all the ""top"" ramen spots, and I always go back to Hide-Chan.",1538781802.0,/r/AskNYC/comments/9lmkh6/great_ramen_suggestions_please_d/e78u5ed/,AskNYC
GGMU1,"My top 3 in no particular order: Ippudo, Nakamura, and Ichiran!

Jun-Men comes close.",1538785071.0,/r/AskNYC/comments/9lmkh6/great_ramen_suggestions_please_d/e78xao4/,AskNYC
Jabsco,I'm a big fan of E.A.K. on 6th Ave,1538795323.0,/r/AskNYC/comments/9lmkh6/great_ramen_suggestions_please_d/e796izw/,AskNYC
momomoomi,Totto Ramen,1545956672.0,/r/AskNYC/comments/9lmkh6/great_ramen_suggestions_please_d/ecp0qe2/,AskNYC
quarkibus,"Hide Chan
Ivan Ramen
Ippudo
Ramen Shack in Astoria
Mu Ramen
Totto Ramen
",1538751124.0,/r/AskNYC/comments/9lmkh6/great_ramen_suggestions_please_d/e77u8hv/,AskNYC
greenasaurus,"
Toto is the best, but not for a sit down date night experience.

Jin Ramen On 83rd and Amsterdam is phenomenal, menu by the same chef as Totto, but with full bar and ambience.

Jin is the best sit down dining experience.

(I’ve also been to all the major ones and many minor)",1538763441.0,/r/AskNYC/comments/9lmkh6/great_ramen_suggestions_please_d/e7899l8/,AskNYC
brazillion,"Totally agree.  The vibe of the Totto on the west side is also outstanding.  It can be a wait, though.  Thankfully, you can just go to a nearby bar on 9th for a quick beer while you wait.",1538753715.0,/r/AskNYC/comments/9lmkh6/great_ramen_suggestions_please_d/e77xd7i/,AskNYC
mwyeep,"Another vote for Totto as the best here, especially among the purely Japanese ones.

I think Ichiran/Ippudo are overrated (not bad, just overrated, and the lines at Ippudo are outrageous) and E.A.K. is underrated. Jin Ramen also pretty good.

Ivan Ramen, Mu Ramen, and Jeju Noodle Bar (ramyun != ramen but pretty close) all offer something unique and awesome.",1538757878.0,/r/AskNYC/comments/9lmkh6/great_ramen_suggestions_please_d/e782g9k/,AskNYC
cipher_9,I second this.,1538752288.0,/r/AskNYC/comments/9lmkh6/great_ramen_suggestions_please_d/e77vmvd/,AskNYC
sidkulk,"Every place I’ve been to I compare against Totto, and no other places lives up to it. 

Go to the ones on the west side btw (51st or 52nd). For some reason Totto on the east side the quality isn’t as good.",1538752583.0,/r/AskNYC/comments/9lmkh6/great_ramen_suggestions_please_d/e77vzlm/,AskNYC
chestercheetaz,east or west?  they're both great!,1538773431.0,/r/AskNYC/comments/9lmkh6/great_ramen_suggestions_please_d/e78lhkt/,AskNYC
nerdlingzergling,I've heard that it has dropped in quality since they opened the other location? confirm/deny,1538774614.0,/r/AskNYC/comments/9lmkh6/great_ramen_suggestions_please_d/e78msid/,AskNYC
soulsnax,YES! Though Hide Chan is also good. ,1538780311.0,/r/AskNYC/comments/9lmkh6/great_ramen_suggestions_please_d/e78so9m/,AskNYC
Thehollyandtheivy,Came here to say this! Bonus points for their brussel sprouts and kale salad. Both are addictive.,1538765460.0,/r/AskNYC/comments/9lmkh6/great_ramen_suggestions_please_d/e78bon9/,AskNYC
drjimmybrungus,"Seconded, their kara miso ramen is my favorite bowl in the city.",1538763660.0,/r/AskNYC/comments/9lmkh6/great_ramen_suggestions_please_d/e789jbk/,AskNYC
yoitsyaboii,This place is heavily underrated. Some of the best in nyc and very affordable/low key.,1538775265.0,/r/AskNYC/comments/9lmkh6/great_ramen_suggestions_please_d/e78nhnm/,AskNYC
CarQuery8989,Mr. Taka is so good,1538789136.0,/r/AskNYC/comments/9lmkh6/great_ramen_suggestions_please_d/e7910ei/,AskNYC
Woodybroadway,"Second, good list",1538783580.0,/r/AskNYC/comments/9lmkh6/great_ramen_suggestions_please_d/e78vve2/,AskNYC
LateralusNYC,"Went for lunch soon after opening, pretty disappointing. I really love lucky cat, in the east fifties",1538763048.0,/r/AskNYC/comments/9lmkh6/great_ramen_suggestions_please_d/e788sko/,AskNYC
chillaschuck,Big fan of Momosan! Their stuff is legit.,1538852473.0,/r/AskNYC/comments/9lmkh6/great_ramen_suggestions_please_d/e7adrzy/,AskNYC
crackersinmybed,I second ramen ya,1538764688.0,/r/AskNYC/comments/9lmkh6/great_ramen_suggestions_please_d/e78arii/,AskNYC
holla171,Oh hell yeah,1538772665.0,/r/AskNYC/comments/9lmkh6/great_ramen_suggestions_please_d/e78klo9/,AskNYC
D3Smee,My favorite place. Really only because i love the spicy red chili ramen. Great mix of flavor and heat. ,1538749798.0,/r/AskNYC/comments/9lmkh6/great_ramen_suggestions_please_d/e77sn31/,AskNYC
GravitationalConstnt,Was going to suggest this.  The cold sesame noodles hnnnnnnnnnnnnnnnnnnnng,1538755718.0,/r/AskNYC/comments/9lmkh6/great_ramen_suggestions_please_d/e77ztbo/,AskNYC
elkresurgence,"I was very skeptical and actually didn't like the shio ramen I ordered, but then they offered to make me a fresh bowl of shoyu ramen free of charge and that was near heavenly. ",1538757674.0,/r/AskNYC/comments/9lmkh6/great_ramen_suggestions_please_d/e7827cs/,AskNYC
FrostbiteZero,"I had Ivan twice, both time the soup came out lukewarm and made the experience difficult to enjoy. I also did not find their soup particularly memorialble.",1538771304.0,/r/AskNYC/comments/9lmkh6/great_ramen_suggestions_please_d/e78j0a1/,AskNYC
chillaschuck,"I love Mitsuwa, but their ramen is kinda mediocre compared to NYC stuff or even the Blackbeard Ramen right around the corner there. Also, probably not a great place for a date like you mentioned, haha. The soft serve black sesame ice cream there is friggin great though!",1538852650.0,/r/AskNYC/comments/9lmkh6/great_ramen_suggestions_please_d/e7adz9y/,AskNYC
FrostbiteZero,"Ichiran is most faithful to the Tokyo ramen experience, except their price point. At $17 as bowl they are more expensive than Totto which I thought was a lot better. It good if you want to try the ramen booth experience, and the soup was decent but not worth the price IMHO.",1538771482.0,/r/AskNYC/comments/9lmkh6/great_ramen_suggestions_please_d/e78j7ta/,AskNYC
drjimmybrungus,Just FYI the Chuko location in Bushwick closed a few months ago.,1538763854.0,/r/AskNYC/comments/9lmkh6/great_ramen_suggestions_please_d/e789ru3/,AskNYC
arsenalfc1987,The one on 10th ave is bigger and usually has a much shorter wait ,1538774041.0,/r/AskNYC/comments/9lmkh6/great_ramen_suggestions_please_d/e78m622/,AskNYC
FrostbiteZero,"I like Totto as well, their soup is nice and very rich and i love their hot sauce. But their noodle is like a 6 out of 10 for me. Not much of a line at their second location which is nice.",1538771122.0,/r/AskNYC/comments/9lmkh6/great_ramen_suggestions_please_d/e78iseu/,AskNYC
lucky_chloe88,I go to the East side location frequently. It started out not as good as the older locations but I believe it has now improved to be on par. My theory is there might be some mother broth that has to be cooked constantly to reach that same level of flavor so it took a little time.,1538772068.0,/r/AskNYC/comments/9lmkh6/great_ramen_suggestions_please_d/e78jwnk/,AskNYC
donkeypooper,"If you want white-washed ramen, go to Chuko!",1538787210.0,/r/AskNYC/comments/9lmkh6/great_ramen_suggestions_please_d/e78zb6i/,AskNYC
FrostbiteZero,"I try every ramen place at least once but this is the first I had heard of Ramen ya, I'll have to stop by and see how it is.",1538771582.0,/r/AskNYC/comments/9lmkh6/great_ramen_suggestions_please_d/e78jbyb/,AskNYC
kealoha,"Did you go to the Gotham West location or the actual shop? Not saying you can't have valid concerns, or that lacking quality at any place is acceptable, but the Gotham West location usually serves their soup too cold for my liking. Never had the problem at his actual store in the LES. ",1538775570.0,/r/AskNYC/comments/9lmkh6/great_ramen_suggestions_please_d/e78ntfh/,AskNYC
dounis42,"Oh yes - I love Matcha Love! I usually get their bubble tea though, not their soft serve.

I actually know some people who prefer Santouka over Totto or Ippudo! Truth be told, I haven't tried Totto myself, but I might be going this weekend.",1538862532.0,/r/AskNYC/comments/9lmkh6/great_ramen_suggestions_please_d/e7ap8ad/,AskNYC
Lost_sidhe,"The argument is that the price includes the tip, so not really that bad compared to $14-16 ramen you find all over the city that doesn't include tip. I understand that Totto is a lot cheaper, though (but when I went by, it was cash only, so I didn't go).",1538771993.0,/r/AskNYC/comments/9lmkh6/great_ramen_suggestions_please_d/e78jte9/,AskNYC
Lost_sidhe,I know. But the original one is still open!,1538763950.0,/r/AskNYC/comments/9lmkh6/great_ramen_suggestions_please_d/e789vz9/,AskNYC
osvargas13,F,1538765773.0,/r/AskNYC/comments/9lmkh6/great_ramen_suggestions_please_d/e78c2cm/,AskNYC
chillaschuck,Do try the black sesame soft serve sometime though! It's pretty great. Their recent seasonal flavor is definitely worth a taste too.,1538871543.0,/r/AskNYC/comments/9lmkh6/great_ramen_suggestions_please_d/e7ayl1b/,AskNYC
drjimmybrungus,"Yep and there is also an outpost in the North 3rd St market in Williamsburg, I was just commenting on the Bushwick one since that's the location you specifically mentioned in your post.",1538764366.0,/r/AskNYC/comments/9lmkh6/great_ramen_suggestions_please_d/e78adur/,AskNYC
Lost_sidhe,"Danke. I thought I typed Brooklyn, but apparently Bushwick just came out of my fingers instead. (It was my favorite! And close enough that I could get fast delivery of their chicken ramen whenever I was sick.)",1538766798.0,/r/AskNYC/comments/9lmkh6/great_ramen_suggestions_please_d/e78dbyp/,AskNYC
vidthai,Ramen Shack,1515877180.0,/r/ramen/comments/7q5wyv/best_ramen_nyc/dsmupx1/,ramen
throwaway_ay_ay_ay99,"I haven’t had it, but it might be fun to watch the “Chef’s Table” episode about Ivan Orkin then eat at Ivan Ramen.",1515882691.0,/r/ramen/comments/7q5wyv/best_ramen_nyc/dsmzn7d/,ramen
Vendetta425,"Ippudo Ramen near hells kitchen is really good.

",1515875275.0,/r/ramen/comments/7q5wyv/best_ramen_nyc/dsmt2wx/,ramen
fuuums,"for ramen, Nakamura is my favorite. their tontoro is esentially tonkotsu. for dim sum, golden dragon in chinatown has never disappointed me. tim ho wan is a good dim sum place too but more modern and more expensive (but was a michelen stared restaurant last year. actually was known as the cheapest michelen stared restaurant). still inexpensive though. ",1515867163.0,/r/ramen/comments/7q5wyv/best_ramen_nyc/dsmlxqm/,ramen
berggg,"I made a similar post and here was the answer I got:

(I went with Nishida Sho Ten, but I imagine all options are worth checking out!)

How late are we talking? Nishida sho-ten is open until 4 am in the morning and when you go after 11 pm, you can get free kaedama! 
Nishida Sho-ten

https://www.yelp.com/biz/nishida-sho-ten-new-york-2?utm_source=ashare&amp;ref=yelp-android


If you want to try ramen by Masaharu Morimoto, you can head to Momosan Ramen. They're open until 11 pm. 
Momosan Ramen &amp; Sake

https://www.yelp.com/biz/momosan-ramen-and-sake-new-york-2?utm_source=ashare&amp;ref=yelp-android


Totto Ramen is open until 11:30 pm and their chicken paitan is unique and delicious. 
Totto Ramen - Midtown East

https://www.yelp.com/biz/totto-ramen-midtown-east-new-york-2?utm_source=ashare&amp;ref=yelp-android


",1515871720.0,/r/ramen/comments/7q5wyv/best_ramen_nyc/dsmpzke/,ramen
Zombee_Brett,"Just to give you another opinion on the places being named;

Totally agree with EndiMoon on Ramen-Ya, they have my favorite broth and I love their chashu.

Even though I hear it a lot, I do not think Ippudo is overrated. Good broth and great al dente noodles (I usually get their classic tonkotsu with nitamago egg and shigureni (pulled pork).  Also their pork buns are amazing.  It is expensive and the wait is crazy.  If you go, go before you are hungry, leave your phone number, and find something nearby to do for the up-to-three-hour wait that happens.

Nakamura is a cool tiny spot with great ramen.  Love their Ajitama eggs.

Ivan Ramen is a cool, unique spot with pretty good ramen and a Jewish spin on Japanese food.  The rye noodles are good, and I like a lot of their small non-ramen plates as well.

Totto is very popular, good ramen but not my personal favorite.

Some other spots to consider - 
Ramen Lab is a very tiny, but cool place that hosts ramen chefs from around the world for a few weeks at a time.  Just check the website to see who is there while you are in town.  
For a low key but good place to get a quick bowl, I like Minca Ramen (they also have a sister restaurant Kambi, which I haven't tried.)  
I also like David Chang's Momofuku Noodle Shop, but more for his food other than the ramen.

Also if you plan to travel outside of Manhattan, Brooklyn and Queens have some shops worth checking out.

",1515946271.0,/r/ramen/comments/7q5wyv/best_ramen_nyc/dso2r8h/,ramen
EndiMoon,Ramen Ya remains the best ramen that I've had in New York. A lot of the hyped up places (see: Ippudo) are a letdown and definitely not worth the wait or the price. Ramen Ya's broth is always on point and they have the best chashu hands down. ,1515877952.0,/r/ramen/comments/7q5wyv/best_ramen_nyc/dsmvdk6/,ramen
,"**The best:** Ramen Shack, Ramen Lab, Tonchin, Yokoya, Mentoku, Shuya Cafe De Ramen, Minca

**Avoid:** Mu, Ivan, Ichiran, Chuko, Momofuku, Totto",1515984846.0,/r/ramen/comments/7q5wyv/best_ramen_nyc/dsp2r6i/,ramen
EatwellCartel,"For a really amazing ramyun event tomorrow in NYC! `

ramyummm.eventbrite.com",1520882178.0,/r/ramen/comments/7q5wyv/best_ramen_nyc/dvl8s5e/,ramen
Schlot,"For dim sum, I assume you meant Gold Unicorn? I think that is the spot I will try. Everyone is recommending it. ",1515867764.0,/r/ramen/comments/7q5wyv/best_ramen_nyc/dsmmgt5/,ramen
fuuums,yeah thats definitely what i meant sorry,1515868133.0,/r/ramen/comments/7q5wyv/best_ramen_nyc/dsmmsd5/,ramen
pgc4512,"Golden Unicorn in Chinatown for cart service Dim Sum

&nbsp;

Mr Taka in LES for Ramen!",1515867143.0,/r/AskNYC/comments/7q60ss/dim_sum_in_nyc_ramen_too/dsmlx3w/,AskNYC
newgirlie,"I see someone here said that Ippudo is overrated, but I personally disagree. Ippudo's Akamaru Modern is what I dream of if I haven't had ramen in a long time.",1515910677.0,/r/AskNYC/comments/7q60ss/dim_sum_in_nyc_ramen_too/dsnm2gh/,AskNYC
IlezAji,"For Dim Sum it really depends on if Flushing will be out of the way for you, Manhattan - Chinatown's Dim Sum offerings are still good but the ones out in Flushing are going to be a bit better. I'll give you some recommendations for both though; for Flushing I usually go with Asian Jewels or Jade, in Manhattan my personal choice is Golden Unicorn but there's also some merit to the cult Jing Fong's got behind it.

Honestly unless you come really early or really late expect to wait around an hour to an hour and a half for peak dim sum times, if you wind up waiting less than that then huzzah.

For Ramen suggestions my top 3 are: Ippudo for classic super-rich tonkatsu broth done extremely well, Ivan Ramen for something a little experimental, or if you can't decide and want something inbetween go for Mu Ramen in LIC.",1515867574.0,/r/AskNYC/comments/7q60ss/dim_sum_in_nyc_ramen_too/dsmmash/,AskNYC
sleepydog,For dim sum I like New Mulan in Flushing,1515873720.0,/r/AskNYC/comments/7q60ss/dim_sum_in_nyc_ramen_too/dsmrql9/,AskNYC
crymsin,"If you're in Brooklyn, Sunset Park's Pacificana also has good dim sum.",1515891995.0,/r/AskNYC/comments/7q60ss/dim_sum_in_nyc_ramen_too/dsn7wwd/,AskNYC
buzzbuzz1,Totto Ramen or Mu Ramen,1515907224.0,/r/AskNYC/comments/7q60ss/dim_sum_in_nyc_ramen_too/dsnk3ah/,AskNYC
,"* Ichiran in Bushwick

* Menkui-Te near MoMa

* Minca on LES

* Momofuku in EV (people will insist this is overrated, but I think it's great)",1515895138.0,/r/AskNYC/comments/7q60ss/dim_sum_in_nyc_ramen_too/dsnai6x/,AskNYC
kevinteng,"Generally if your whole party gets there before 11 am or after 130 pm you won't have to wait, make sure you find the guy giving seats when you walk in (sometimes they have a clipboard or give numbers instead of a traditional host)",1515887477.0,/r/AskNYC/comments/7q60ss/dim_sum_in_nyc_ramen_too/dsn3whg/,AskNYC
Kwebster7327,Hop Shing in Chinatown for the full experience.,1515895408.0,/r/AskNYC/comments/7q60ss/dim_sum_in_nyc_ramen_too/dsnaqcc/,AskNYC
rip_tree_stump,"(Manhattan) A first-timer will be amused by the sheer size of Jing Fong on Elizabeth Street. Standard cart offerings, and quality of food is above average. ",1515899717.0,/r/AskNYC/comments/7q60ss/dim_sum_in_nyc_ramen_too/dsnehfl/,AskNYC
hockeyfun1,I've had 88 Palace and Golden Unicorn (and maybe a couple others that I don't remember).,1515903519.0,/r/AskNYC/comments/7q60ss/dim_sum_in_nyc_ramen_too/dsnhhw8/,AskNYC
iftair,"Last weekend I went to Ajisen Noodle Restaurant (14 Mott Street, Chinatown) for ramen for my first time and it was REALLY tasty.",1515914312.0,/r/AskNYC/comments/7q60ss/dim_sum_in_nyc_ramen_too/dsnntua/,AskNYC
lost_in_life_34,The diner on Main Street and I-495 was OK. Lake pavilion or something like that,1515866732.0,/r/AskNYC/comments/7q60ss/dim_sum_in_nyc_ramen_too/dsmlkfj/,AskNYC
Izvmo13,"Don't go to Ippudo. It's overrated. Go to Tonchin on 36th, it's soooooo good! The only downside is that you can't order a kaedama. ",1515897186.0,/r/AskNYC/comments/7q60ss/dim_sum_in_nyc_ramen_too/dsnc8ho/,AskNYC
Schlot,Thank you! Everyone is telling me Gold Unicorn or Jin Fong. what do you think between the two?,1515867202.0,/r/AskNYC/comments/7q60ss/dim_sum_in_nyc_ramen_too/dsmlyyx/,AskNYC
Schlot,"Thank you for all the suggestions! There is an Ippudo Kuro - Obi right near our hotel, so I will definitely try that.",1515867868.0,/r/AskNYC/comments/7q60ss/dim_sum_in_nyc_ramen_too/dsmmk2b/,AskNYC
Schlot,Side note: It looks like the actual Ippudo's have more full menus. Which one would you recommend?,1515868866.0,/r/AskNYC/comments/7q60ss/dim_sum_in_nyc_ramen_too/dsmnfzd/,AskNYC
Schlot,Side note: It looks like the actual Ippudo's have more full menus. Which one would you recommend?,1515868877.0,/r/AskNYC/comments/7q60ss/dim_sum_in_nyc_ramen_too/dsmngc9/,AskNYC
,Seconding Totto Ramen,1516001312.0,/r/AskNYC/comments/7q60ss/dim_sum_in_nyc_ramen_too/dspd5fp/,AskNYC
Hfy_addict,Is ichiran worth it? Was so surprised they went with us pricing. ,1515934008.0,/r/AskNYC/comments/7q60ss/dim_sum_in_nyc_ramen_too/dsnvc22/,AskNYC
,"I also had Ajisen for my first ramen. I was blown away when I first had it and it was really good for that first time, but I've since had better and when I went back, it was just meh. It's a good first ramen spot though.",1516001417.0,/r/AskNYC/comments/7q60ss/dim_sum_in_nyc_ramen_too/dspd7a4/,AskNYC
Schlot,Thanks for the recommendation! I'm looking for something great though to impress a first timer.,1515867132.0,/r/AskNYC/comments/7q60ss/dim_sum_in_nyc_ramen_too/dsmlws9/,AskNYC
NewYawhk,Golden Unicorn and Jing Fong are both great choices. You'll be happy at either. I usually go to Jing Fong.,1515867608.0,/r/AskNYC/comments/7q60ss/dim_sum_in_nyc_ramen_too/dsmmbuk/,AskNYC
Glorious_Emperor,I personally prefer Golden Unicorn but Jing Fong is a very close second,1515886564.0,/r/AskNYC/comments/7q60ss/dim_sum_in_nyc_ramen_too/dsn34e8/,AskNYC
